1196,RETRO PINK BALL ASHTRAY ,1.25,LIDL
1197,PACK OF 20 FAIRY CAKE PAPER NAPKINS,0.85,ALDI
1198,FAIRY CAKES WALL THERMOMETER,2.55,Tesco
1199,WASHROOM METAL SIGN,1.25,Tesco
1200,SET 12 LAVENDER BOTANICAL T-LIGHTS,2.95,Tesco
1201,CANDLE IN JAR COLLAGE VANILLA,2.55,LIDL
1202,ECONOMY PASSPORT COVER ,2.1,Sainsbury's
1203,LARGE CHUNKY GLASS ROMAN BOWL,6.75,LIDL
1204,POSY SHOPPER BAG,1.25,Tesco
1205,FAIRY CAKES TILE COASTER,1.25,LIDL
1206,4 LILY BOTANICAL DINNER CANDLES,3.75,ALDI
1207,PING MICROWAVE APRON,5.95,ASDA
1208,OFFICE MUG WARMER PINK,4.95,Tesco
1209,MIDNIGHT GLAMOUR SCARF KNITTING KIT,2.95,LIDL
1210,DOLLY MIXTURE CHILDREN'S UMBRELLA,3.25,Tesco
1211,SET OF PICTURE FRAME STICKERS,2.95,Sainsbury's
1212,ROSE SCENT CANDLE JEWELLED DRAWER,4.25,ALDI
1213,TEA TIME DES TEA COSY,2.55,LIDL
1214,BLACK CHRISTMAS TREE 120CM,8.49,Tesco
1215,TEA TIME TEA SET IN GIFT BOX,6.95,Tesco
1216,S/16 VINTAGE BLACK CUTLERY,12.75,Tesco
1217,PINK STITCHED WALL CLOCK,3.75,ASDA
1218,TEATIME ROUND CAKE TINS ,9.95,LIDL
1219,CONDIMENT TRAY 4 BOWLS AND 4 SPOONS,9.95,Sainsbury's
1220,WHITE METAL LANTERN,3.75,ALDI
1221,RETRO SPOT PADDED SEAT CUSHION,3.75,LIDL
1222,PINK GINGHAM ROSE FLOOR CUSHION,7.95,Sainsbury's
1223,BLUE GINGHAM ROSE QUILT ,45.95,ALDI
1224,TRIANGULAR POUFFE VINTAGE ,14.95,ASDA
1225,CHILLI LIGHTS,4.95,ALDI
1226, FLAMINGO LIGHTS,4.95,Sainsbury's
1227,DECORATION HANGING HEART+MIRROR ,0.65,Tesco
1228,S/3 PINK COL METAL BASKET W HANDLE,12.75,LIDL
1229,SMALL MARAKESH METAL LANTERN ,3.25,ALDI
1230,JARDIN DE FEMME SCENTED CANDLE,2.95,LIDL
1231,SKULLS WRITING SET ,1.65,LIDL
1232,SKULLS STORAGE BOX LARGE,2.95,LIDL
1233,SET OF 12 ROSE BOTANICAL T-LIGHTS,2.95,Tesco
1234,VICTORIAN METAL POSTCARD SPRING,1.69,ASDA
1235,CREAM SLICE FLANNEL CHOCOLATE SPOT ,2.55,Sainsbury's
1236,ETCHED GLASS DROPLET DECORATION,1.45,ASDA
1237,PINK FLOCK GLASS CANDLEHOLDER,1.65,ASDA
1238,WOOD STAMP SET THANK YOU,1.65,Sainsbury's
1239, SILVER T-LIGHT SETTING,6.75,Sainsbury's
1240,LADLE LOVE HEART PINK,0.42,Tesco
1241,ROSE CARAVAN DOORSTOP,6.75,ASDA
1242,BUBBLE GUM SCARF KNITTING KIT,2.95,ALDI
1243,FOOD/DRINK SPUNGE STICKERS,0.21,LIDL
1244,FAIRY CAKE GREETINGS CARD,0.42,ALDI
1245,FRYING PAN PINK POLKADOT ,4.25,Tesco
1246,MILK PAN PINK RETROSPOT,3.75,LIDL
1247,ASSTD DESIGN RACING CAR PEN,1.69,Tesco
1248,RETRO PLASTIC 70'S TRAY,1.25,ASDA
1249,TEA PARTY WRAPPING PAPER ,0.42,Sainsbury's
1250,BROCADE PURSESMALL ARCH BUTTON,0.29,ALDI
1251,STARS GIFT TAPE ,0.65,ALDI
1252,SKULLS TAPE,0.65,ALDI
1253,CAKES AND BOWS GIFT TAPE,0.65,ASDA
1254,CUTE CATS TAPE,0.65,ASDA
1255,RED AND WHITE SPOT TAPE,0.65,Tesco
1256,LIGHT PINK FLOCK GLASS CANDLEHOLDER,1.65,ALDI
1257,WOODLAND PARTY BAG + STICKER SET,1.65,Tesco
1258,ANTIQUE ALL GLASS CANDLESTICK,2.1,ALDI
1259,BLUE ROCKING SINGING CANARY,3.75,ASDA
1260,WOODLAND ANIMAL WRITING SET ,1.65,ASDA
1261,SILVER GLITTER FLOWER VOTIVE HOLDER,1.25,Sainsbury's
1262,ELEPHANT BIRTHDAY CARD ,0.42,LIDL
1263,ANGEL DECORATION WITH LACE PADDED,0.85,Tesco
1264,MIRROR LOVE BIRD T-LIGHT HOLDER,3.75,ASDA
1265,GIN & TONIC DIET GREETING CARD ,0.42,Tesco
1266,BANK ACCOUNT GREETING CARD ,0.42,Sainsbury's
1267,NEW BAROQUE JEWELLERY BOX ,7.95,Sainsbury's
1268,SET OF 4 POLKADOTS COASTERS,1.25,ALDI
1269,FLOWER FAIRY INCENSE LAVENDER,1.69,ALDI
1270,RED HEART LUGGAGE TAG,1.25,Tesco
1271,GIANT MEDINA STAMPED METAL BOWL ,9.95,LIDL
1272,JUNGLE POPSICLES ICE LOLLY HOLDERS,1.25,Tesco
1273,ASSORTED COLOUR JUMBO PEN,0.42,ASDA
1274,WHITE SNOW SCANDINAVIAN STOCKING ,1.25,Tesco
1275,SET OF 4 NEW ENGLAND COASTERS ,1.25,ASDA
1276,PINK MINI TAPE MEASURE ,0.85,Tesco
1277,FOLKART ZINC HEART CHRISTMAS DEC,0.85,Tesco
1278,WHITE RETRODISC LAMPSHADE,1.95,Sainsbury's
1279,CLEAR COLOUR GLASS GEMS IN BAG,0.85,Tesco
1280,TEA TIME BREAKFAST BASKET,2.1,Sainsbury's
1281,SILVER WASHBAG,2.95,Tesco
1282,ROSES IN WHITE HEART CANDLE ,1.25,Sainsbury's
1283,FAIRY CAKE CERAMIC BUTTER DISH,2.55,LIDL
1284,VINTAGE NOTEBOOK BEAUTY GIRL,2.95,LIDL
1285,ROMANTIC IMAGES GIFT WRAP SET,2.1,ASDA
1286,YULETIDE IMAGES S/6 PAPER BOXES,2.55,ASDA
1287,PINK JEWELLED PHOTO FRAME ,4.95,ASDA
1288,FRENCH EMROIDR LAVENDER SCENT HEART,2.1,ASDA
1289,"PEARL & SHELL 42""NECKL. IVORY",10.75,ASDA
1290,DIAMANTE BOW BROOCH GREEN COLOUR,6.35,LIDL
1291,SET/20 WOODLAND PAPER NAPKINS ,0.85,Sainsbury's
1292,"PEARL & SHELL 42""NECKL. PINK",8.49,ALDI
1293,SMALL REGAL SILVER CANDLEPOT ,2.95,ALDI
1294,BLACK CHAMPAGNE GLASS,1.65,ALDI
1295,SET/6 BLACK ROSE T-LIGHT CANDLES,1.69,ALDI
1296,ORANGE VOTIVE CANDLE,0.29,Sainsbury's
1297,LILAC VOTIVE CANDLE,0.21,LIDL
1298,ASSORTED COLOUR SET 6 TEASPOONS,4.25,Sainsbury's
1299,TEA COSY RED STRIPE,2.55,ALDI
1300,STRAWBERRY LUNCHBOX WITH CUTLERY,2.55,Sainsbury's
1301,SET OF 36 MUSHROOM PAPER DOILIES,1.45,LIDL
1302,BLUE FLORIBUNDA EGG WARMER,1.25,Sainsbury's
1303,YULETIDE IMAGES GIFT WRAP SET,2.1,ALDI
1304,SPRING FLOWER CHOPSTICKS SET/5,1.95,Tesco
1305,PINK CHICK EGG WARMER + EGG CUP,2.1,ALDI
1306,SKULLS STICKERS,0.85,ALDI
1307,BLUE HAPPY BIRTHDAY BUNTING,5.45,ASDA
1308,BLACK CHRISTMAS FLOCK DROPLET ,1.25,LIDL
1309,GLITTER HEART GARLAND WITH BELLS ,3.75,LIDL
1310,BLACK BAROQUE CUCKOO CLOCK,12.75,ASDA
1311,BLACK BAROQUE CARRIAGE CLOCK,9.95,ALDI
1312,WHITE BAROQUE CARRIAGE CLOCK,9.95,ALDI
1313,BLUE/CREAM STRIPE FRINGE HAMMOCK,7.95,ASDA
1314,RIO PINK STRIPE HAMMOCK,7.95,LIDL
1315,STRAWBERRY PICNIC BAG,2.95,Tesco
1316,EMPIRE GIFT WRAP,0.42,ASDA
1317,DINOSAUR HEIGHT CHART STICKER SET,2.95,ASDA
1318,FLOWERS STICKERS,0.85,ASDA
1319,WHITE/BLUE PULL BACK RACING CAR,0.55,Tesco
1320,CAMOUFLAGE BACKPACK ON WHEELS,9.95,ASDA
1321,ANTIQUE GLASS RIDGED HANGING BALL,1.65,Tesco
1322,PAPER CHAIN KIT EMPIRE,2.95,Tesco
1323,BASKET OF FLOWERS SEWING KIT,0.85,ALDI
1324,SWALLOW SQUARE TISSUE BOX,1.25,LIDL
1325,AMBER BERTIE GLASS BEAD BAG CHARM,2.1,ALDI
1326,TURQUOISE GLASS TASSLE BAG CHARM ,2.95,LIDL
1327,CERAMIC BIRDHOUSE BLACK ROSE LARGE,5.95,Tesco
1328,YELLOW SHARK HELICOPTER,7.95,Sainsbury's
1329,BLUE TRAVEL FIRST AID KIT,1.65,LIDL
1330,F FAIRY POTPOURRI CUSHIONS SUMMER,1.69,ALDI
1331,GOLD TEDDY BEAR,3.75,ALDI
1332,ESSENTIAL BALM 3.5g TIN IN ENVELOPE,0.18,ASDA
1333,SWEETIES STICKERS,0.85,Sainsbury's
1334,COW SOCK PUPPET,2.95,ASDA
1335,CERAMIC BIRDHOUSE BUTTERFLY LARGE,5.95,LIDL
1336,BUTTONS AND STRIPES NOTEBOOK ,3.75,ALDI
1337,BLUE NEW BAROQUE CANDLESTICK CANDLE,2.95,Sainsbury's
1338,CAROUSEL DES CHILD'S OVERALL,2.1,LIDL
1339,SCOTTIES DESIGN BABY BIB,1.25,ALDI
1340,MOODY GIRL DOOR HANGER ,1.45,ASDA
1341,LOO ROLL METAL SIGN ,1.65,LIDL
1342,ASSORTED COLOUR SUCTION CUP HOOK,0.19,ASDA
1343,PICTURE FRAME WOOD TRIPLE PORTRAIT,6.75,LIDL
1344,NEW ENGLAND MILK JUG W GIFT BOX,5.95,Sainsbury's
1345,NEW ENGLAND CERAMIC CAKE SERVER,2.55,ALDI
1346,PARTY CONES CANDY TREE DECORATION,0.85,ALDI
1347,VINTAGE PINK DECORATIVE PARASOL,12.75,ALDI
1348,ASS FLORAL PRINT TAPE MEASURE,1.25,Sainsbury's
1349,BLUE GINGHAM ROSE CUSHION COVER,5.95,LIDL
1350,LOVE GARLAND PAINTED ZINC ,1.65,ALDI
1351,HOME GARLAND PAINTED ZINC ,1.65,Sainsbury's
1352,CHRISTMAS DECOUPAGE CANDLE,0.85,ASDA
1353,S/3 PUPPIES CHRISTMAS DECORATIONS,2.95,LIDL
1354,FRENCH BOTTLE BRASSERIE DES ARTIST,1.45,Sainsbury's
1355,LONG SILVER NECKLACE PASTEL FLOWER,12.75,ALDI
1356,FLOWER BROOCH 4 ASSORTED COLOURS,4.95,Sainsbury's
1357,SILVER CHARM NECKLACE 70CM,7.5,LIDL
1358,BLACK+WHITE NECKLACE W TASSEL,9.95,ALDI
1359,CHUNKY SILVER NECKLACE PASTEL FLOWE,9.95,ALDI
1360,RESIN NECKLACE W PASTEL BEADS,7.5,Sainsbury's
1361,BEACH HUT DESIGN BLACKBOARD,4.25,ALDI
1362,FILIGRIS HEART WITH BUTTERFLY,1.25,Sainsbury's
1363,ENAMEL BLUE RIM TEA CONTAINER,2.1,ALDI
1364,ENAMEL BLUE RIM COFFEE CONTAINER,2.1,ASDA
1365,"LETTER ""A"" BLING KEY RING",1.25,LIDL
1366,LARGE CAKE STAND HANGING STRAWBERY,9.95,ALDI
1367,SET OF 36 DINOSAUR PAPER DOILIES,1.45,ALDI
1368,SET OF 72 SKULL PAPER DOILIES,1.45,ASDA
1369,FLOWER BURST SILVER RING GREEN,3.75,LIDL
1370,FLOWER BURST SILVER RING ROSE,3.75,Sainsbury's
1371,FLOWER BURST SILVER RING CRYSTAL,3.75,ALDI
1372,FLOWER BURST SILVER RING MIDN'T BLU,3.75,ALDI
1373,TIGRIS EYE CHUNKY CHARM BRACELET,8.95,Tesco
1374,SILVER/CRYSTAL DROP EARRINGS W LEAF,2.95,Sainsbury's
1375,RUBY DROP CHANDELIER EARRINGS,3.75,LIDL
1376,VINTAGE ENAMEL & CRYSTAL EARRINGS,4.95,Tesco
1377,ENGLISH ROSE NOTEBOOK A6 SIZE,0.65,LIDL
1378,ENGLISH ROSE TABLE CLOTH,10.65,LIDL
1379,FOLK ART GREETING CARDpack/12,2.95,Sainsbury's
1380,BAG 250g SWIRLY MARBLES,0.85,LIDL
1381,BUTTERFLY CROCHET FOOD COVER,3.75,ALDI
1382,LION SOCK PUPPET,2.95,Sainsbury's
1383,HANGING RIDGE GLASS T-LIGHT HOLDER,1.69,ALDI
1384,SET/2 SPOTTY + ROSE TEA TOWELS ,2.55,Tesco
1385,WOOD STAMP SET BEST WISHES,1.65,ASDA
1386,3D DOG PICTURE PLAYING CARDS,2.95,ASDA
1387,36 PENCILS TUBE POSY,1.25,Sainsbury's
1388,DANISH ROSE PHOTO FRAME,2.55,Sainsbury's
1389,GINGHAM HEART WREATH,2.95,ALDI
1390,ETCHED GLASS BIRD TREE DECORATION,1.25,ALDI
1391,WHITE HANGING BEADS CANDLE HOLDER,5.45,Tesco
1392,SMALL SPOTTY CHOCOLATE GIFT BAG ,0.85,LIDL
1393,IF YOU CAN'T STAND THE HEAT MUG,1.25,LIDL
1394,GLAMOROUS MUG,1.25,Tesco
1395,GIN AND TONIC MUG,1.25,LIDL
1396,SET/12 TAPER CANDLES,0.85,ALDI
1397,TOAST ITS - HAPPY BIRTHDAY,1.25,ASDA
1398,WHITE GOOSE FEATHER CHRISTMAS TREE ,16.95,Tesco
1399,PASTEL BLUE PHOTO ALBUM ,5.55,ALDI
1400,VINTAGE KEEPSAKE BOX BEAUTY GIRL,6.35,ALDI
1401,FOLKART HEART NAPKIN RINGS,2.95,LIDL
1402,BERRIES CHUNKY KNITTED THROW ,16.95,Tesco
1403,ENGLISH ROSE SMALL SCENTED FLOWER,0.85,LIDL
1404,WELCOME METAL SIGN,1.25,Tesco
1405,FLORAL DINOSAUR GREEN,4.25,Tesco
1406,CHERRY BLOSSOM PHOTO FRAME ,4.65,ASDA
1407,TRIANGULAR RIDGED GLASS POSY HOLDER,0.65,ALDI
1408,PACK/12 RUSSIAN DOLL CARDS,2.95,ASDA
1409,ENAMEL BLUE RIM BISCUIT BIN,4.95,ALDI
1410,SMALL HEART FLOWERS HOOK ,0.85,LIDL
1411,ROTATING LEAVES T-LIGHT HOLDER,2.55,LIDL
1412,EASTER DECORATION NATURAL CHICK,0.65,ALDI
1413,TUMBLER NEW ENGLAND,1.65,ALDI
1414,TUMBLER ENGLISH ROSE,1.65,Sainsbury's
1415,BATHROOM METAL SIGN ,1.45,Tesco
1416,BEADED CRYSTAL HEART BLUE SMALL,1.25,LIDL
1417,IVORY HANGING DECORATION BUTTERFLY,0.85,ASDA
1418,IVORY HANGING DECORATION CHICKEN,0.85,ASDA
1419,BLUE CHALET BIRDFEEDER,3.75,ASDA
1420,ENGLISH ROSE PHOTO FRAME ,4.65,Sainsbury's
1421,WHITE BAROQUE WALL CLOCK ,12.75,LIDL
1422,CANDY PINK FRENCH BOUDOIR CLOCK,9.95,Tesco
1423,SET OF 3 PINK FLYING DUCKS,5.45,ALDI
1424,WHITE METAL BAROQUE PHOTO FRAME,3.75,Sainsbury's
1425,RED PEONY PHOTO FRAME ,4.65,ALDI
1426,MINI CAKE STAND HANGING HEARTS,1.65,Sainsbury's
1427,S/12 VANILLA BOTANICAL T-LIGHTS,2.95,Tesco
1428,S/2 BEACH HUT STOOLS,7.95,Tesco
1429,NATURAL BARK CANDLE LARGE,3.75,Tesco
1430,SET/6 TURQUOISE BUTTERFLY T-LIGHTS,2.1,ALDI
1431,RED ENCHANTED FOREST PLACEMAT,1.65,ASDA
1432,WHITE HONEYCOMB PAPER FAN ,2.1,Sainsbury's
1433,PADDED RED HEART DECORATION,1.25,LIDL
1434,SET/16 WHITE SHINY & MATT BAUBLES,2.1,Sainsbury's
1435,PAINTED METAL STAR WITH HOLLY BELLS,1.45,ASDA
1436,PAINTED METAL HEART WITH HOLLY BELL,1.45,ASDA
1437,CHRISTMAS TREE STAR DECORATION,0.42,LIDL
1438,BLUE TILED TRAY,6.75,LIDL
1439,CURIOUS IMAGES SCRAP BOOK SET,4.95,Tesco
1440,HEART SHAPE WIRELESS DOORBELL,2.1,LIDL
1441,RED SPOTTY PASSPORT COVER,2.1,ALDI
1442,BLACK SMALL GLASS CAKE STAND,1.95,ALDI
1443,SILVER ROCOCO CANDELABRA,12.75,Tesco
1444,PINK DIAMANTE PEN IN GIFT BOX,4.95,Sainsbury's
1445,S/4 BLACK DINNER CANDLE SILVER FLOC,2.55,ALDI
1446,SET OF 3 BIRD L.BLUE FEATHER,1.25,Sainsbury's
1447,RETRO LONGBOARD IRONING BOARD COVER,3.75,ASDA
1448,HEART EAR MUFF HEADPHONES,5.49,Tesco
1449,VINTAGE PINK TINSEL REEL ,2.1,Sainsbury's
1450,ROMANTIC IMAGES SCRAP BOOK SET,4.95,ASDA
1451,POP'S GREASY SPOON METAL SIGN,1.65,LIDL
1452,KITTENS DESIGN FLANNEL,0.85,Tesco
1453,FLOWER FAIRY MUG+COASTERLAVENDER,3.75,ASDA
1454,PINK HEART SHAPE PHOTO FRAME,1.65,Sainsbury's
1455,ROBOT MUG IN DISPLAY BOX,1.25,Sainsbury's
1456,MULTICOLOUR RABBIT EGG WARMER,2.1,ALDI
1457,PINK SPOTS CHOCOLATE NESTING BOXES ,2.95,Sainsbury's
1458,BATHROOM SCALES RUBBER DUCKS,3.75,Sainsbury's
1459,SET/6 GOLD REINDEER T-LIGHT CANDLES,1.95,Sainsbury's
1460,QUEEN OF THE SKIES PASSPORT COVER ,2.1,ASDA
1461,PINK HORSE SOCK PUPPET,2.95,Tesco
1462,PINK AND WHITE CHRISTMAS TREE 120CM,2.95,Sainsbury's
1463,CERAMIC STRAWBERRY TRINKET TRAY,2.55,LIDL
1464,FELT EGG COSY BLUE RABBIT ,0.85,ASDA
1465,ASSTD MULTICOLOUR CIRCLES MUG,1.69,Tesco
1466,PINK SQUARE COMPACT MIRROR,3.75,ASDA
1467,JEWELLED DECORATIONPINK,2.95,ASDA
1468,PORCELAIN BUTTERFLY OIL BURNER,2.95,Tesco
1469,SOMBRERO ,1.95,Sainsbury's
1470,CAKE STAND LOVEBIRD 2 TIER WHITE,9.95,ALDI
1471,GREEN GLASS TASSLE BAG CHARM,2.95,ALDI
1472,VINTAGE BEAD NOTEBOOK,2.95,ALDI
1473,TRELLIS FLOWER CHOPSTICKS SET/5,1.95,ASDA
1474,6 HOOK JEWEL STAND LILAC DRESS,8.49,Sainsbury's
1475,FAIRY DREAMS INCENSE ,0.21,LIDL
1476,GLITTER SNOW PEAR TREE DECORATION,1.45,ASDA
1477,SET/6 ANGEL T-LIGHTS WHITE/GOLD,1.25,ASDA
1478,CERAMIC BIRDHOUSE CRESTED TIT LARGE,5.95,LIDL
1479,ENGLISH ROSE DESIGN SHOPPING BAG,2.55,ASDA
1480,MOON INCENSE,0.21,ASDA
1481,GROOVY CACTUS INFLATABLE,0.85,ALDI
1482,SILVER DIAMANTE PEN IN GIFT BOX,4.95,ALDI
1483,LILAC DIAMANTE PEN IN GIFT BOX,4.95,ASDA
1484,OPULENT VELVET SET/3 CANDLES,1.25,ASDA
1485,SHOPPING BAG DOORSTOP,1.25,ASDA
1486,PINK CURRENT CANDLE RING,0.19,LIDL
1487,FOLK ART METAL HEART T-LIGHT HOLDER,0.38,ALDI
1488,PRICE'S CANDLE PEACH,0.08,ALDI
1489,F.FAIRY S/3 CANDLE/GLASSLILY/VALLY,1.95,Sainsbury's
1490,JACOBS LADDER SMALL,0.06,Tesco
1491,SILVER/BLACK ORBIT NECKLACE,9.95,Tesco
1492,SILVER TEDDY BEAR,1.25,ASDA
1493,BLACK PHOTO ALBUM ,1.95,ASDA
1494,PASTEL BLUE PHOTO ALBUM,1.95,ASDA
1495,PASTEL PINK PHOTO ALBUM,1.95,ASDA
1496,FLORAL SOFT CAR TOY,3.75,Sainsbury's
1497,CANDY SPOT BUNNY,2.95,ASDA
1498,WOOD ANIMALS HEIGHT CHART STICKERS ,2.95,ASDA
1499,RED DAISY PAPER LAMPSHADE,1.25,ALDI
1500,CAKE STAND VICTORIAN FILIGREE SMALL,4.95,Sainsbury's
1501,CAKE STAND VICTORIAN FILIGREE MED,6.75,Tesco
1502,BEIGE PHOTO ALBUM,1.95,ALDI
1503,ASSORTED COLOUR SILK GLASSES CASE,0.38,LIDL
1504,RIBBON REEL LACE DESIGN ,1.85,LIDL
1505,FELTCRAFT 6 FLOWER FRIENDS,2.1,ALDI
1506,SET OF 3 VINTAGE TEA TIME BOXES,1.65,ASDA
1507,OFFICE MUG WARMER CHOC+BLUE,4.95,LIDL
1508,OFFICE MUG WARMER BLACK+SILVER ,4.95,Sainsbury's
1509,SET/20 COLLAGE PAPER NAPKIN ,0.85,LIDL
1510,CERAMIC STRWBERRY DESIGN MUG,1.49,Sainsbury's
1511,PACK 6 HEART/ICE-CREAM PATCHES,1.25,ALDI
1512,WOOD STAMP SET HAPPY BIRTHDAY,1.65,ASDA
1513,RED EGG SPOON,0.42,LIDL
1514,BLUE EGG SPOON,0.42,ASDA
1515,RETRO SPOT CANDLE MEDIUM,2.1,Tesco
1516,VICTORIAN METAL POSTCARD CHRISTMAS,1.65,Sainsbury's
1517,BLUE STONES ON WIRE FOR CANDLE,0.08,Tesco
1518,SET OF 3 BIRD LIGHT PINK FEATHER ,1.25,Sainsbury's
1519,PINK POODLE HANGING DECORATION ,1.45,Sainsbury's
1520,5 HOOK BLACKBOARD ORGANISER ,9.95,ASDA
1521,GLASS BONBON JAR PARFUME AUX FLEURE,1.25,Tesco
1522,GLASS BONBON JAR. D'AMANDES,1.25,Sainsbury's
1523,GLASS BONBON JAR. SUPERFINES,1.25,ALDI
1524,PINK CLEAR GLASS CANDLE PLATE,1.25,ASDA
1525,SET/6 PINK BUTTERFLY T-LIGHTS,2.1,ASDA
1526,BUNNY WOODEN PAINTED WITH BIRD ,0.85,Sainsbury's
1527,TUB 24 HANGING EASTER EGGS SPOTTY,3.75,Sainsbury's
1528,HAPPY EASTER HANGING DECORATION,3.75,ASDA
1529,HEN HOUSE DECORATION,1.65,ASDA
1530,MOROCCAN TEA GLASS,0.85,ASDA
1531,ENVELOPE 50 ROMANTIC IMAGES,0.85,Tesco
1532,SET/3 VANILLA SCENTED CANDLE IN BOX,4.25,ASDA
1533,STRAWBERRY HONEYCOMB GARLAND ,1.65,Sainsbury's
1534,BUTTERFLIES HONEYCOMB GARLAND,1.65,Tesco
1535,3D HEARTS HONEYCOMB PAPER GARLAND,2.95,LIDL
1536,PINK BITTY LIGHT CHAIN,4.65,Tesco
1537,GREEN BITTY LIGHT CHAIN,4.65,ALDI
1538,PINK HEARTS LIGHT CHAIN ,4.65,LIDL
1539,RED HEARTS LIGHT CHAIN ,4.65,Tesco
1540,SET/10 IVORY SPOTTY PARTY CANDLES,1.25,Sainsbury's
1541,DUCK SOCK PUPPET,2.95,LIDL
1542,FROG SOCK PUPPET,2.95,LIDL
1543,WALL MIRROR RECT DIAMANTE PINK/,7.95,ASDA
1544,DECORATIVE ROSE BATHROOM BOTTLE,1.25,LIDL
1545,BLACK WINE GLASS,1.45,Tesco
1546,WRAP DAISY CARPET ,0.42,LIDL
1547,SQUARE FLOOR CUSHION VINTAGE PINK ,7.95,LIDL
1548,VINTAGE POST OFFICE CABINET,79.95,Tesco
1549, RIDGED GLASS T-LIGHT HOLDER,0.55,LIDL
1550,SMALL SILVER TRELLIS CANDLEPOT,2.95,Tesco
1551,SMALL HAMMERED SILVER CANDLEPOT ,2.95,Sainsbury's
1552,SILVER PLATE CANDLE BOWL LARGE,3.75,LIDL
1553,SILVER PLATE CANDLE BOWL SMALL,2.95,Sainsbury's
1554,HANGING GLASS ETCHED TEALIGHT,1.65,ASDA
1555,75 BLACK PETIT FOUR CASES,0.42,Sainsbury's
1556,S/4 PINK FLOWER CANDLES IN BOWL,1.65,ASDA
1557,CRYSTAL CZECH CROSS PHONE CHARM,0.85,Sainsbury's
1558,FUNKY GIRLZ MAGNETIC TO DO LIST ,0.65,LIDL
1559,WOODEN HAPPY BIRTHDAY GARLAND,2.95,ASDA
1560, HOME SWEET HOME BLACKBOARD,6.35,ASDA
1561,ETCHED GLASS COASTER,1.25,Tesco
1562,ANTIQUE GLASS PLACE SETTING,1.25,ASDA
1563,SANDALWOOD FAN,0.85,LIDL
1564,CANDY STRIPE ROSE C/COVER ,5.95,Tesco
1565,ASSORTED TUTTI FRUTTI SMALL PURSE,1.25,Tesco
1566,TWO EMBOSSED HEART MINI DRAWERS,6.95,Sainsbury's
1567,WOOLLY HAT SOCK GLOVE ADVENT STRING,5.95,Tesco
1568,KNITTED MUG COSY IVORY COLOUR ,1.65,ALDI
1569,TEA COSY BLUE STRIPE,2.55,ALDI
1570,S/4 ROSE BOTANICAL CANDLE,3.75,Tesco
1571,SILVER CANDLEPOT JARDIN ,3.75,LIDL
1572,FAIRY CAKES GIFT BAG,0.42,Sainsbury's
1573,BOTANICAL ROSE GREETING CARD,0.42,ASDA
1574,BOTANICAL LILY GREETING CARD,0.42,ALDI
1575,WRAP PINK FLOCK,0.42,Sainsbury's
1576,DISTRESSED CANDLE STICK WHITE,5.95,ALDI
1577,ZINC FINISH 15CM PLANTER POTS,1.25,Sainsbury's
1578,ENAMEL PINK COFFEE CONTAINER,2.1,Sainsbury's
1579,ENAMEL PINK TEA CONTAINER,2.1,Tesco
1580,ENAMEL PINK SUGAR CONTAINER,2.1,LIDL
1581,RED SPOTTY WASHBAG,2.1,Sainsbury's
1582,PACK 4 FLOWER/BUTTERFLY PATCHES,1.25,Tesco
1583,LARGE CAKE TOWEL PINK SPOTS,6.75,Sainsbury's
1584,NURSE'S BAG SOFT TOY,8.95,ALDI
1585,DOCTOR'S BAG SOFT TOY,8.95,Tesco
1586,PINK PADDED MOBILE,4.25,ALDI
1587,FILIGREE WALL MIRROR ANTIQUE WHITE,14.75,Sainsbury's
1588,PINK LOVE HEART SHAPE CUP,0.85,LIDL
1589,RED LOVE HEART SHAPE CUP,0.85,ASDA
1590,BLUE HARMONICA IN BOX ,1.25,LIDL
1591,OLD DOC.RUSSEL METAL SIGN,2.1,ALDI
1592,BEADED PEARL HEART WHITE ON STICK,1.25,LIDL
1593,MILK BOTTLE WITH GLASS STOPPER ,6.95,ALDI
1594,SCANDINAVIAN 3 HEARTS NAPKIN RING,0.65,ALDI
1595,PINK HANGING GINGHAM EASTER HEN,0.42,LIDL
1596,BLUE HANGING GINGHAM EASTER HEN,0.42,ALDI
1597,SPRING DEC HANGING CHICK YELLOW,1.45,ALDI
1598,DECORATION WOBBLY CHICKEN METAL ,1.65,LIDL
1599,DECORATION WOBBLY RABBIT METAL ,1.65,ASDA
1600,SET/9 CHRISTMAS T-LIGHTS SCENTED ,1.25,LIDL
1601,RETRO SPOT CANDLE SMALL,1.69,ASDA
1602,GREEN WIRE STANDING CANDLE HOLDER,3.75,LIDL
1603,RED/WHITE SPOT PICNIC BAG,2.95,LIDL
1604,SKULLS STORAGE BOX SMALL,2.1,ALDI
1605,SKULLS PARTY BAG + STICKER SET,1.65,LIDL
1606,VINTAGE UNION JACK PENNANT,1.95,ASDA
1607,SKULLS SQUARE TISSUE BOX,1.25,ALDI
1608,EMPIRE DESIGN ROSETTE,1.25,Sainsbury's
1609,S/4 ICON COASTERELVIS LIVES,1.25,ALDI
1610,BENDY COLOUR PENCILS,0.42,Sainsbury's
1611,WAY OUT METAL SIGN ,1.65,Sainsbury's
1612,ASSTD HEARTS DESIGN MUGS,1.95,ASDA
1613,MILK PAN BLUE RETROSPOT,3.75,ALDI
1614,METAL SIGNCUPCAKE SINGLE HOOK,1.25,ALDI
1615,FAIRY CAKE PLACEMATS ,3.75,Tesco
1616,PINK HEART SHAPE LOVE BUCKET ,2.95,LIDL
1617,PARTY PIZZA DISH BLUE WHITE SPOT ,0.85,ASDA
1618,PARTY PIZZA DISH PINK WHITE SPOT ,0.85,Tesco
1619,PARTY PIZZA DISH GREEN WHITE SPOT ,0.85,Sainsbury's
1620,BEACH HUT SHELF W 3 DRAWERS,5.95,LIDL
1621,PINK KNITTED COW STUFFED TOY,3.75,LIDL
1622,PACK OF 12 PINK PAISLEY TISSUES ,0.25,ASDA
1623,RED SPOTTY TABLECLOTH ,10.65,ALDI
1624,DAIRY MAID SMALL MILK JUG,2.1,Sainsbury's
1625,"LETTER ""C"" BLING KEY RING",1.25,LIDL
1626,"LETTER ""D"" BLING KEY RING",1.25,ALDI
1627,FOLKART STAR CHRISTMAS DECORATIONS,1.25,LIDL
1628,WHITE WITH BLACK CATS BOWL,0.85,Sainsbury's
1629,COLOURFUL FISHING GNOME,5.95,Tesco
1630,SET/4 DAISY MIRROR MAGNETS,2.1,LIDL
1631,WHITE BELL HONEYCOMB PAPER GARLAND ,1.65,ALDI
1632,KISS REINDEER SCANDINAVIAN STOCKING,2.55,ALDI
1633,FANNY'S REST STOPMETAL SIGN,2.1,ASDA
1634,"RETRO ""TEA FOR ONE"" ",4.95,ALDI
1635,75 BLACK FAIRY CAKE CASES,0.55,ALDI
1636,WHITE WITH BLACK CATS PLATE,0.85,LIDL
1637,BLACK PILLAR CANDLE SILVER FLOCK,2.55,Sainsbury's
1638,SET/6 FROG PRINCE T-LIGHT CANDLES,2.1,LIDL
1639,ASSORTED TUTTI FRUTTI HEART BOX,1.25,LIDL
1640,ASSORTED TUTTI FRUTTI MIRROR,1.25,ALDI
1641,HANGING FLOWERS+MIRRORCLEAR,1.49,Sainsbury's
1642,ACRYLIC JEWEL SNOWFLAKEBLUE,2.55,ALDI
1643,BLUE SQUARE COMPACT MIRROR,3.75,ALDI
1644,POLYESTER FILLER PAD 30CMx30CM,1.25,LIDL
1645,ENGLISH ROSE EDWARDIAN PARASOL,3,Sainsbury's
1646,ORANGE COCKTAIL GLASS LAMP,2.1,Sainsbury's
1647,WOVEN ROSE GARDEN CUSHION COVER ,4.95,ALDI
1648,FAIRY CAKE DESIGN UMBRELLA,3.75,ALDI
1649,PINK ROSE WASHBAG,2,ALDI
1650,PINK BUTTERFLY WASHBAG,2,ASDA
1651,ROSE DU SUD COSMETICS BAG,2,LIDL
1652,GOLD/AMBER DROP EARRINGS W LEAF,2.95,LIDL
1653,AMBER CHUNKY GLASS+BEAD NECKLACE,11.95,Tesco
1654,SILVER BLACK ORBIT BRACELET,4.95,LIDL
1655,NEW BAROQUE B'FLY NECKLACE GREEN,8.5,Sainsbury's
1656,BLACK CRYSTAL DROP EARRINGS,2.95,Tesco
1657,BLACK DROP CRYSTAL NECKLACE,9.95,ALDI
1658,EAU DE NILE JEWELLED PHOTOFRAME,2.55,ALDI
1659,KASHMIR FOLKART TUMBLERS,2.1,ASDA
1660,COWBOYS AND INDIANS BIRTHDAY CARD ,0.42,ASDA
1661,RETRO PLASTIC DAISY TRAY,0.42,ASDA
1662,IVORY ENCHANTED FOREST PLACEMAT,1.65,LIDL
1663,OWL DOORSTOP,4.95,LIDL
1664,VINTAGE KITCHEN PRINT FRUITS,2.55,ALDI
1665,RIBBONS PURSE ,2.1,ASDA
1666,OCEAN SCENT CANDLE JEWELLED DRAWER,4.25,ASDA
1667,SCOTTIES DESIGN CHILD'S OVERALL,2.1,Tesco
1668,CROCHET BEAR RED/BLUE KEYRING,1.65,Tesco
1669,BATH DUCK WATERING CAN,2.95,Sainsbury's
1670,MEDIUM CHINESE STYLE SCISSOR,0.5,Sainsbury's
1671,BLUE FLYING SINGING CANARY,3.75,ASDA
1672,ABSTRACT CIRCLES SKETCHBOOK ,3.75,ALDI
1673,FAIRY CAKES TABLE CLOCK,8.95,LIDL
1674,SET OF 3 GOLD FLYING DUCKS,6.35,Tesco
1675,DINOSAUR PARTY BAG + STICKER SET,1.65,ASDA
1676,ASSORTED WHITE EMBOSSED CHINA MUGS,2.1,Tesco
1677,HANGING BAUBLE T-LIGHT HOLDER SMALL,2.55,Tesco
1678,6 RIBBONS SHIMMERING PINKS ,1.65,LIDL
1679,GOLD MINI TAPE MEASURE ,0.85,ASDA
1680,LARGE MEDINA STAMPED METAL BOWL ,4.95,ALDI
1681,RED SPOTTY PUDDING BOWL,2.1,Sainsbury's
1682,FOLKART ZINC STAR CHRISTMAS DEC,0.85,Sainsbury's
1683,FREESTYLE CANVAS ART PICTURE,4.25,ALDI
1684,MANHATTAN CANVAS ART PICTURE,12.75,Tesco
1685,FANCY FONT BIRTHDAY CARD ,0.42,Tesco
1686,ROSES ON BLUE TEACUP CANDLE ,1.69,ALDI
1687,DECOUPAGEGREETING CARD,0.42,ASDA
1688,CERAMIC PLATE STRAWBERRY DESIGN,1.49,LIDL
1689,DOG TOY WITH PINK CROCHET SKIRT,3.75,LIDL
1690,DARK PINK FLOCK GLASS CANDLEHOLDER,1.65,ALDI
1691,METAL MEDINA LANTERN ,12.75,ASDA
1692,HANGING MEDINA LANTERN SMALL,2.95,Tesco
1693,GLASS CAKE COVER AND PLATE,16.95,ASDA
1694,TOOL BOX SOFT TOY ,8.95,Tesco
1695,STRIPEY CHOCOLATE NESTING BOXES,2.95,ASDA
1696,BOUDOIR SQUARE TISSUE BOX,1.25,LIDL
1697,ENGLISH ROSE IRONING BOARD COVER,3.75,Sainsbury's
1698,BLUE SHARK HELICOPTER,7.95,Tesco
1699,SPRING DEC HANGING CHICK CREAM,1.45,ALDI
1700,PINK B'FLY C/COVER W BOBBLES,5.95,Sainsbury's
1701,IVORY HANGING DECORATION BIRD,0.85,ALDI
1702,SET OF 3 SILVER FLYING DUCKS,6.35,ASDA
1703,GREEN MINI TAPE MEASURE ,0.85,ASDA
1704,SMALL CHINESE STYLE SCISSOR,0.32,ASDA
1705,LARGE CHINESE STYLE SCISSOR,0.72,LIDL
1706,EMBROIDERED REINDEER DECORATION,2.12,ALDI
1707,12 IVORY ROSE PEG PLACE SETTINGS,1.25,LIDL
1708,KEY FOB GARAGE DESIGN,0.65,Tesco
1709,IVORY HANGING BIRD PLANTER ,2.55,ASDA
1710,12 RED ROSE PEG PLACE SETTINGS,1.25,Sainsbury's
1711,PORCELAIN ROSE SMALL,0.85,Tesco
1712,STRING OF STARS CARD HOLDER,2.95,LIDL
1713,MEDIUM MEDINA STAMPED METAL BOWL ,2.95,ASDA
1714,RIDGED GLASS STORAGE JAR CREAM LID,3.75,ASDA
1715,SKULLS DESIGN FLANNEL,0.85,LIDL
1716,CHOC TRUFFLE GOLD TRINKET POT ,1.65,Sainsbury's
1717,LARGE TORTILLA DESIGN RED BOWL,3.75,ASDA
1718,FEATHER DUSTER LIGHT PINK,1.25,LIDL
1719,WOODLAND WATER TRANSFER TATTOOS ,0.85,Tesco
1720,SET/4 SKULL BADGES,1.25,Tesco
1721,3 HEARTS HANGING DECORATION RUSTIC,2.95,ASDA
1722,WHITE GRAND BAROQUE PHOTO FRAME,4.25,Tesco
1723,GOLD COSMETIC BAG PINK STAR,2.1,Sainsbury's
1724,RIDGED GLASS POSY VASE ,1.45,Sainsbury's
1725,CLASSICAL ROSE URN,7.95,LIDL
1726,MINI WOODEN HAPPY BIRTHDAY GARLAND,1.69,ASDA
1727,PINK PATCH PURSE BLUE HEART,1.65,Sainsbury's
1728,GARDEN PATH NOTEBOOK ,1.65,LIDL
1729,FLOWER BLUE CLOCK W/SUCKER,0.85,ASDA
1730,BLUE PATCH PURSE PINK HEART,1.65,ALDI
1731,FLOWER PURPLE CLOCK W/SUCKER,0.85,ASDA
1732,"FLOWER GLASS GARLAND NECKL.36""BLUE",7.95,Sainsbury's
1733,AMETHYST CHUNKY BEAD BRACELET W STR,8.95,Tesco
1734,GARDENIA 1 WICK MORRIS BOXED CANDLE,4.25,Sainsbury's
1735,RED VICTORIAN FABRIC HEART BOX,0.42,ALDI
1736,ENGLISH ROSE HOT WATER BOTTLE,1.5,ALDI
1737,MAN FLU METAL SIGN,2.1,Tesco
1738,PINK POLKADOT KIDS BAG,4.95,ALDI
1739,DECORATIVE NET CANOPY CREAM,8.95,ALDI
1740,PINK/WHITE RIBBED MELAMINE JUG,7.95,ASDA
1741,WHITE WIRE EGG HOLDER,5.95,Sainsbury's
1742,75 GREEN PETIT FOUR CASES,0.42,ASDA
1743,CARRIAGE,50,LIDL
1744,ALPHABET HEARTS STICKER SHEET,0.85,ASDA
1745,PINK CRYSTAL SKULL PHONE CHARM,0.85,ALDI
1746,CUBIC MUG PINK POLKA DOT,2.55,ASDA
1747,WHITE BITTY LIGHT CHAIN ,4.65,ALDI
1748,PINK FEATHER CHRISTMAS DECORATION,1.25,LIDL
1749,RIDGED GLASS FINGER BOWL,1.45,ASDA
1750,SMALL CHUNKY GLASS ROMAN BOWL,2.95,ASDA
1751,PIG KEYRING WITH LIGHT & SOUND ,1.25,Tesco
1752,WOVEN BERRIES CUSHION COVER ,4.95,LIDL
1753,ASSORTED ICE CREAM FRIDGE MAGNETS,0.65,Sainsbury's
1754,PINK NEW BAROQUECANDLESTICK CANDLE,2.95,ALDI
1755,WHITE NEWBAROQUE CANDLESTICK CANDLE,2.95,ASDA
1756,SKULL AND CROSSBONES GARLAND ,1.65,Sainsbury's
1757,ELVIS WALLHANGING / CURTAIN,1.25,Sainsbury's
1758,MURANO STYLE GLASS BRACELET PINK,3.5,Sainsbury's
1759,GREEN MURANO TWIST BRACELET,4.25,LIDL
1760,POMPOM CURTAIN,5.95,LIDL
1761,SPACE BOY GIFT WRAP,0.42,ASDA
1762,BIRTHDAY BANQUET GIFT WRAP,0.42,Tesco
1763,PINK PAISLEY ROSE GIFT WRAP,0.42,Sainsbury's
1764,VINTAGE CARAVAN GIFT WRAP,0.42,ASDA
1765,CARAVAN SQUARE TISSUE BOX,1.25,Tesco
1766,FEATHER PENHOT PINK,0.85,LIDL
1767,FEATHER PENLIGHT PINK,0.85,Sainsbury's
1768,ENVELOPE 50 BLOSSOM IMAGES,0.85,ALDI
1769,ENVELOPE 50 CURIOUS IMAGES,0.85,ALDI
1770,GARDEN PATH POCKET BOOK,0.85,LIDL
1771,BOTANICAL ROSE GIFT WRAP,0.42,Sainsbury's
1772,CAKE PLATE LOVEBIRD PINK,4.95,Tesco
1773,MULTI COLOUR SILVER T-LIGHT HOLDER,0.85,Tesco
1774,BLUE POLKADOT KIDS BAG,4.95,LIDL
1775,FLOWER FAIRY INCENSE BOUQUET,1.69,ALDI
1776,FLOWER FAIRY OIL BURNER SET SUMMER,4.25,Sainsbury's
1777,CUPID DESIGN SCENTED CANDLES,2.55,ASDA
