0,15CM CHRISTMAS GLASS BALL 20 LIGHTS,6.95,Sainsbury's
1,PINK CHERRY LIGHTS,6.75,LIDL
2, WHITE CHERRY LIGHTS,6.75,ALDI
3,"RECORD FRAME 7"" SINGLE SIZE ",2.1,LIDL
4,STRAWBERRY CERAMIC TRINKET BOX,1.25,ASDA
5,PINK DOUGHNUT TRINKET POT ,1.65,Tesco
6,SAVE THE PLANET MUG,1.25,LIDL
7,FANCY FONT HOME SWEET HOME DOORMAT,5.95,ALDI
8,CAT BOWL ,2.55,Sainsbury's
9,DOG BOWL CHASING BALL DESIGN,3.75,Tesco
10,HEART MEASURING SPOONS LARGE,1.65,ASDA
11,LUNCHBOX WITH CUTLERY FAIRY CAKES ,2.55,ASDA
12,DOOR MAT BLACK FLOCK ,5.95,Tesco
13,LOVE BUILDING BLOCK WORD,5.45,Tesco
14,HOME BUILDING BLOCK WORD,5.95,Sainsbury's
15,ASSORTED COLOUR BIRD ORNAMENT,1.69,ALDI
16, PEACE WOODEN BLOCK LETTERS,6.95,LIDL
17,CHRISTMAS CRAFT WHITE FAIRY ,1.45,LIDL
18,HEART IVORY TRELLIS LARGE,1.65,ALDI
19,HEART FILIGREE DOVE LARGE,1.65,LIDL
20,FULL ENGLISH BREAKFAST PLATE,3.39,ASDA
21,PIZZA PLATE IN BOX,3.75,ASDA
22,BLACK DINER WALL CLOCK,8.5,ASDA
23,SET OF 3 BLACK FLYING DUCKS,4.65,ALDI
24,AREA PATROLLED METAL SIGN,2.1,ALDI
25,PLEASE ONE PERSON METAL SIGN,2.1,LIDL
26,BATH BUILDING BLOCK WORD,5.95,ALDI
27,CLASSIC WHITE FRAME,2.95,Sainsbury's
28,SMALL MARSHMALLOWS PINK BOWL,1.25,ALDI
29,BISCUITS SMALL BOWL LIGHT BLUE,1.25,Sainsbury's
30,SCOTTIE DOG HOT WATER BOTTLE,4.25,ALDI
31,CHRISTMAS CRAFT HEART DECORATIONS,2.1,Sainsbury's
32,CHRISTMAS CRAFT HEART STOCKING ,2.1,LIDL
33,PARTY CONE CHRISTMAS DECORATION ,0.85,ASDA
34,PEACE SMALL WOOD LETTERS,6.75,LIDL
35,JOY LARGE WOOD LETTERS,9.95,LIDL
36,CINAMMON & ORANGE WREATH,6.75,Sainsbury's
37,EUCALYPTUS & PINECONE WREATH,6.75,LIDL
38,WOODEN BOX ADVENT CALENDAR ,8.95,LIDL
39,FLORAL BLUE MONSTER,4.25,Sainsbury's
40,RETRO COFFEE MUGS ASSORTED,1.25,ALDI
41,INFLATABLE POLITICAL GLOBE ,0.85,LIDL
42,STRIPES DESIGN MONKEY DOLL,2.55,Tesco
43,BLUE PADDED SOFT MOBILE,4.25,Tesco
44,PACK OF 6 SKULL PAPER CUPS,0.65,Tesco
45,PACK OF 20 SKULL PAPER NAPKINS,0.85,Tesco
46,HANGING HEART ZINC T-LIGHT HOLDER,0.85,LIDL
47,PINK BLUE FELT CRAFT TRINKET BOX,1.25,LIDL
48,FELTCRAFT DOLL ROSIE,2.95,Sainsbury's
49,FELTCRAFT DOLL MARIA,2.95,ASDA
50,FELTCRAFT DOLL EMILY,2.95,ALDI
51,VINTAGE SNAKES & LADDERS,3.75,LIDL
52,CHOCOLATE HOT WATER BOTTLE,4.95,ASDA
53,DINOSAURS WRITING SET ,0.98,ALDI
54,SET OF MEADOW FLOWER STICKERS,1.69,Tesco
55,CHARLIE AND LOLA CHARLOTTE BAG,1.15,ALDI
56,JUMBO BAG CHARLIE AND LOLA TOYS,2,ASDA
57,JUMBO BAG TOYS ,1.3,Sainsbury's
58,COUNTRY COTTAGE DOORSTOP GREEN,2.5,LIDL
59,GINGHAM HEART DOORSTOP RED,2.5,LIDL
60,CHARLIE+LOLA RED HOT WATER BOTTLE ,3,ALDI
61,CHARLIE LOLA BLUE HOT WATER BOTTLE ,3,ALDI
62,CHARLIE+LOLA PINK HOT WATER BOTTLE,1.9,LIDL
63,CHARLIE + LOLA RED HOT WATER BOTTLE,1.9,ASDA
64,TOMATO CHARLIE+LOLA COASTER SET,2.15,Tesco
65,CARROT CHARLIE+LOLA COASTER SET,2.4,Sainsbury's
66,CHARLIE + LOLA BISCUITS TINS,6.38,ASDA
67,CHARLIE AND LOLA FIGURES TINS,6.4,LIDL
68,CHARLIE & LOLA WASTEPAPER BIN BLUE,2.4,ALDI
69,CHARLIE & LOLA WASTEPAPER BIN FLORA,2.4,ASDA
70,CHRISTMAS PUDDING TRINKET POT ,1.45,ASDA
71,BAKING SET 9 PIECE RETROSPOT ,4.95,Sainsbury's
72,RETRO SPOT TEA SET CERAMIC 11 PC ,4.95,ALDI
73,LUNCHBOX WITH CUTLERY RETROSPOT ,2.55,Sainsbury's
74,BLACK/BLUE DOTS RUFFLED UMBRELLA,5.95,ALDI
75,RED/WHITE DOTS RUFFLED UMBRELLA,5.95,ALDI
76,WRAP ENGLISH ROSE ,0.42,ALDI
77,WRAP BLUE RUSSIAN FOLKART,0.42,ASDA
78,SET OF THREE VINTAGE GIFT WRAPS,1.95,Sainsbury's
79,RETRO SPORT PARTY BAG + STICKER SET,1.65,ALDI
80,ASSORTED CAKES FRIDGE MAGNETS,0.65,LIDL
81, VINTAGE DESIGN GIFT TAGS,0.85,LIDL
82,RED TOADSTOOL LED NIGHT LIGHT,1.65,ALDI
83,SET/3 RUSSIAN DOLL STACKING TINS,4.95,ASDA
84,PACK 20 DOLLY PEGS,0.85,Sainsbury's
85,ASSORTED COLOUR MINI CASES,7.95,ASDA
86,POSTAGE,18,LIDL
87,BIRD DECORATION RED SPOT,0.72,LIDL
88,RED WOOLLY HOTTIE WHITE HEART.,2.95,LIDL
89,UNION JACK GUNS & ROSES DOORMAT,6.75,Tesco
90,YELLOW + BROWN BEAR FELT PURSE KIT,1.25,Sainsbury's
91,WHITE HANGING HEART T-LIGHT HOLDER,2.95,ASDA
92,KINGS CHOICE SMALL TUBE MATCHES,1.65,ALDI
93,KINGS CHOICE GIANT TUBE MATCHES,2.55,ALDI
94,KINGS CHOICE CIGAR BOX MATCHES ,1.25,ASDA
95,EMPIRE TISSUE BOX,1.25,Sainsbury's
96,GREETING CARD THE BLACK CAT,0.42,LIDL
97,RAINY LADIES BIRTHDAY CARD,0.42,Sainsbury's
98,BANQUET BIRTHDAY CARD ,0.42,ASDA
99,SPACE BOY BIRTHDAY CARD,0.42,LIDL
100,RING OF ROSES BIRTHDAY CARD,0.42,LIDL
101,BOTANICAL LAVENDER BIRTHDAY CARD,0.42,ALDI
102,SET3 BOOK BOX GREEN GINGHAM FLOWER ,4.25,ALDI
103,SET/3 RED GINGHAM ROSE STORAGE BOX,3.75,Sainsbury's
104,SET 12 RETRO WHITE CHALK STICKS,0.42,Tesco
105,VINTAGE SNAP CARDS,0.85,Sainsbury's
106,BINGO SET,3.75,LIDL
107,VICTORIAN SEWING KIT,1.25,LIDL
108,RETRO RED SPOTTY WASHING UP GLOVES,2.1,LIDL
109,SET/2 RED SPOTTY TEA TOWELS ,2.95,ALDI
110,VINYL RECORD FRAME SILVER,3.39,Sainsbury's
111,BATHROOM METAL SIGN,0.55,LIDL
112,LADIES & GENTLEMEN METAL SIGN,2.55,LIDL
113,RED SPOTTY OVEN GLOVE DOUBLE,2.95,ALDI
114,PINK FELT HANGING HEART W FLOWER,0.85,LIDL
115,BLUE FELT HANGING HEART W FLOWER,0.85,LIDL
116,RETRO SPOT LAMP,9.95,ALDI
117,PARTY CONES CANDY ASSORTED,1.25,LIDL
118,HEART STRING MEMO HOLDER HANGING,2.95,ALDI
119,FOLKART BAUBLE CHRISTMAS DECORATION,0.38,LIDL
120,6 CROCHET STRAWBERRIES,1.25,ALDI
121,SET OF 72 PINK HEART PAPER DOILIES,1.45,ALDI
122,LOVEBIRD HANGING DECORATION WHITE ,0.85,ALDI
123,WHITE TALL PORCELAIN T-LIGHT HOLDER,2.55,ALDI
124,EDWARDIAN TOILET ROLL UNIT ,12.75,ALDI
125,SET/6 STRAWBERRY PAPER CUPS,0.65,Sainsbury's
126,SET/6 WOODLAND PAPER CUPS,0.65,Tesco
127,JUMBO BAG PINK VINTAGE PAISLEY,1.95,LIDL
128,"GARLAND WOODEN "" HAPPY EASTER""",1.25,Tesco
129,SET/6 WOODLAND PAPER PLATES,0.85,Sainsbury's
130,RED HANGING HEART T-LIGHT HOLDER,2.55,Sainsbury's
131,VICTORIAN GLASS HANGING T-LIGHT,1.25,LIDL
132,UNION JACK HOT WATER BOTTLE ,5.95,LIDL
133,RED SPOT CERAMIC DRAWER KNOB,1.25,ASDA
134,PAPER CHAIN KIT 50'S CHRISTMAS ,2.95,ALDI
135,HEART FILIGREE DOVE SMALL,1.25,LIDL
136,FRYING PAN RED POLKADOT ,4.25,ASDA
137,PAPER CHAIN KIT RETRO SPOT,2.95,ALDI
138,HOT WATER BOTTLE TEA AND SYMPATHY,3.95,LIDL
139,RED SPOT HEART HOT WATER BOTTLE,4.95,Sainsbury's
140,JUMBO BAG SCANDINAVIAN PAISLEY,1.95,ALDI
141,JUMBO BAG RED WHITE SPOTTY ,1.95,ALDI
142,CHARLOTTE BAG PINK/WHITE SPOTS,0.85,ALDI
143,RED SPOTTY CHARLOTTE BAG,0.85,Sainsbury's
144,RETRO SPOT CIGAR BOX MATCHES ,1.25,ALDI
145,LUNCH BAG RED SPOTTY,1.65,ASDA
146,LUNCH BAG CARS BLUE,1.65,ALDI
147,LUNCH BAG WOODLAND,1.65,LIDL
148,RED SPOTTY ROUND CAKE TINS,8.95,ASDA
149,LARGE HEART MEASURING SPOONS,1.65,Sainsbury's
150,CREAM SWEETHEART MINI CHEST,12.75,Sainsbury's
151,GOLD APERITIF GLASS,2.12,Tesco
152,GOLD WINE GLASS,3.39,Sainsbury's
153,GOLD WINE GOBLET,4.25,Sainsbury's
154,SILVER APERITIF GLASS,2.12,ASDA
155,PAPER BUNTING WHITE LACE,2.95,LIDL
156,CREAM FELT EASTER EGG BASKET,1.65,Sainsbury's
157,POTTING SHED SOW 'N' GROW SET,4.25,LIDL
158,POTTING SHED TWINE,2.1,ALDI
159,ANTIQUE SILVER TEA GLASS ETCHED,1.25,Sainsbury's
160,PAPER BUNTING RETRO SPOTS,2.95,LIDL
161,PACK OF 60 PINK PAISLEY CAKE CASES,0.55,LIDL
162,60 TEATIME FAIRY CAKE CASES,0.55,ASDA
163,FELTCRAFT DOLL MOLLY,2.95,LIDL
164,SET 10 LIGHTS NIGHT OWL,6.75,ASDA
165,BIRDS MOBILE VINTAGE DESIGN,5.95,Sainsbury's
166,3 PIECE JIGSAW TOADSTOOLS,1.65,Tesco
167,BOYS ALPHABET IRON ON PATCHES,0.21,LIDL
168, SILVER CHERRY LIGHTS,6.75,Sainsbury's
169,GIRLS ALPHABET IRON ON PATCHES ,0.21,ALDI
170,RED STRIPE CERAMIC DRAWER KNOB,1.25,ASDA
171,BLUE STRIPE CERAMIC DRAWER KNOB,1.25,ALDI
172,BLUE SPOT CERAMIC DRAWER KNOB,1.25,LIDL
173,WHITE SPOT RED CERAMIC DRAWER KNOB,1.25,ASDA
174,WHITE SPOT BLUE CERAMIC DRAWER KNOB,1.25,Sainsbury's
175,BLUE CHARLIE+LOLA PERSONAL DOORSIGN,2.95,ASDA
176,RED CHARLIE+LOLA PERSONAL DOORSIGN,2.95,Sainsbury's
177,KEEP OUT BOYS DOOR HANGER ,1.45,ASDA
178,TOXIC AREA DOOR HANGER ,1.45,LIDL
179,DOOR HANGER MUM + DADS ROOM,1.45,ALDI
180,MOODY BOY DOOR HANGER ,1.45,ALDI
181,WOODEN FRAME ANTIQUE WHITE ,2.95,Sainsbury's
182,WOOD S/3 CABINET ANT WHITE FINISH,7.95,Sainsbury's
183,WOOD 2 DRAWER CABINET WHITE FINISH,5.95,ASDA
184,PINK SWEETHEART BRACELET,4.25,Tesco
185,GREEN SWEETHEART BRACELET,4.25,ALDI
186,PACK OF 72 RETRO SPOT CAKE CASES,0.55,ALDI
187,FAIRY CAKE CANDLES,1.49,ASDA
188,CERAMIC BOWL WITH STRAWBERRY DESIGN,2.95,Tesco
189,CERAMIC CAKE BOWL + HANGING CAKES,2.95,ALDI
190,PURPLE SWEETHEART BRACELET,4.25,ALDI
191,BLUE SWEETHEART BRACELET,4.25,ASDA
192,BLACK SWEETHEART BRACELET,4.25,LIDL
193,BLACK DIAMANTE EXPANDABLE RING,4.25,Tesco
194,AMETHYST DIAMANTE EXPANDABLE RING,4.25,Tesco
195,MIDNIGHT BLUE PAIR HEART HAIR SLIDE,3.75,Tesco
196,CRYSTAL PAIR HEART HAIR SLIDES,3.75,Tesco
197,ROSE COLOUR PAIR HEART HAIR SLIDES,3.75,Tesco
198,PINK ENAMEL+GLASS HAIR COMB,2.1,ASDA
199,PURPLE ENAMEL+GLASS HAIR COMB,2.1,Tesco
200,DIAMANTE BOW BROOCH BLACK COLOUR,6.35,ALDI
201,FOLDING UMBRELLA BLACK/BLUE SPOT,4.95,Tesco
202,FOLDING UMBRELLA PINK/WHITE SPOT,4.95,Tesco
203,FOLDING UMBRELLA CREAM/MULTI SPOT,4.95,Sainsbury's
204,FOLDING UMBRELLA RED/WHITE SPOT,4.95,ASDA
205,FOLDING UMBRELLA WHITE/RED SPOT,4.95,ALDI
206,PICCADILLY TEA SET,14.95,Tesco
207,RETRO BLUE SPOTTY WASHING UP GLOVES,2.1,LIDL
208,RETRO PINK SPOT WASHING UP GLOVES,2.1,ASDA
209,FUNKY WASHING UP GLOVES ASSORTED,2.1,ASDA
210,DOOR MAT FAIRY CAKE,6.75,ASDA
211,FAWN BLUE HOT WATER BOTTLE,2.95,ASDA
212,ANTIQUE LILY FAIRY LIGHTS,4.25,ASDA
213,VINTAGE CREAM 3 BASKET CAKE STAND,9.95,Tesco
214,MUSHROOM BLUE HOT WATER BOTTLE,2.95,Tesco
215,CHICK GREY HOT WATER BOTTLE,3.45,Sainsbury's
216,GREY FLORAL FELTCRAFT SHOULDER BAG,3.75,Sainsbury's
217,PINK FLORAL FELTCRAFT SHOULDER BAG,3.75,Sainsbury's
218,PINK CROCHET CAT WITH SCARF,4.25,ASDA
219,PINK CREAM FELT CRAFT TRINKET BOX ,1.25,LIDL
220,PINK JUMPER LARRY THE LAMB,2.1,Tesco
221,SET OF THREE 50'S GIFT WRAPS ,1.95,ASDA
222,PARTY INVITES JAZZ HEARTS,0.85,Tesco
223,PARTY INVITES WOODLAND,0.85,ASDA
224,PINK 3 PIECE MINI DOTS CUTLERY SET,3.75,ALDI
225,BLUE 3 PIECE MINI DOTS CUTLERY SET,3.75,ALDI
226,COFFEE MUG CAT + BIRD DESIGN,2.55,Sainsbury's
227,COFFEE MUG DOG + BALL DESIGN,2.55,Sainsbury's
228,SWEETHEART CERAMIC TRINKET BOX,1.25,LIDL
229,OPULENT VELVET CANDLE IN BOX,2.1,Sainsbury's
230,VINTAGE ROSE BEAD BRACELET BLUE,4.25,LIDL
231,WHITE GLASS CHUNKY CHARM BRACELET,8.95,ALDI
232,BLACK GEMSTONE BRACELET,8.95,Tesco
233,CARNIVAL BRACELET,12.75,ASDA
234,JUMBO STORAGE BAG SKULLS,1.95,Sainsbury's
235,LADYBIRD + BEE RAFFIA FOOD COVER,3.75,Tesco
236,TEA TIME PARTY BUNTING,4.65,ASDA
237,WEEKEND BAG VINTAGE ROSE PAISLEY,8.5,ASDA
238,WHITE SKULL HOT WATER BOTTLE ,3.75,Sainsbury's
239,VINTAGE HEADS AND TAILS CARD GAME ,1.06,Sainsbury's
240,COLOUR GLASS. STAR T-LIGHT HOLDER,2.75,ALDI
241,CERAMIC CAKE STAND + HANGING CAKES,8.5,Tesco
242,MINI CAKE STAND WITH HANGING CAKES,1.25,LIDL
243,VICTORIAN SEWING BOX LARGE,10.95,ALDI
244,SET/3 TALL GLASS CANDLE HOLDER PINK,3.95,Tesco
245,PINK FAIRY CAKE CHILD'S APRON,1.65,LIDL
246,PINK UNION JACK LUGGAGE TAG,1.25,LIDL
247,LAUNDRY 15C METAL SIGN,1.25,ALDI
248,AIRLINE LOUNGEMETAL SIGN,2.1,LIDL
249,METAL SIGN CUPCAKE SINGLE HOOK,1.25,ALDI
250,NO JUNK MAIL METAL SIGN,1.25,Sainsbury's
251,PINK UNION JACK PASSPORT COVER ,2.1,Sainsbury's
252,BLACK SIL'T SQU CANDLE PLATE ,2.1,Tesco
253,WOODLAND CHARLOTTE BAG,0.85,LIDL
254,POTTING SHED COFFEE MUG,1.25,Sainsbury's
255,POTTERING MUG,1.25,ALDI
256,FAIRY SOAP SOAP HOLDER,1.69,Sainsbury's
257,UNION JACK FLAG PASSPORT COVER ,2.1,ALDI
258,FLOWER VINE RAFFIA FOOD COVER,3.75,Sainsbury's
259,VINTAGE NOTEBOOK PARIS DAYS,2.95,Sainsbury's
260,SQUARE MIRROR CURTAIN,7.95,LIDL
261,ENGLISH ROSE TEA SET IN GIFT BOX,4.65,ASDA
262,GREEN 3 PIECE MINI DOTS CUTLERY SET,3.75,Sainsbury's
263,GREEN SPOTTY PLATE ,1.69,LIDL
264,GREEN SPOTTY CUP,0.85,ALDI
265,BAG 500g SWIRLY MARBLES,1.65,ASDA
266,VINTAGE SEASIDE JIGSAW PUZZLES,3.75,Tesco
267,PINK STRAWBERRY HANDBAG ,2.95,ASDA
268,GLITTER STAR GARLAND WITH BELLS ,3.75,LIDL
269,HAIRCLIPS FORTIES FABRIC ASSORTED,0.65,Sainsbury's
270,RETRO SPOT SMALL TUBE MATCHES,1.65,Sainsbury's
271,JUMBO STORAGE BAG SUKI,1.95,Tesco
272,CAROUSEL DES CHILD'S APRON,1.65,LIDL
273,RED 3 PIECE MINI DOTS CUTLERY SET,3.75,LIDL
274,SET OF 2 FANCY FONT TEA TOWELS,2.95,Tesco
275,CROSS STITCH ALPHABET CUSHION COVER,5.95,ASDA
276,S/4 PISTACHIO LOVEBIRD COASTERS,2.55,Sainsbury's
277,HEART DECORATION PAINTED ZINC ,0.65,ALDI
278,WHITE PEARL BEADED HEART SMALL,1.25,Tesco
279,GINGHAM HEART DECORATION,2.95,Tesco
280,BLUE SPOTTY PLATE ,1.69,ASDA
281,BLUE SPOTTY BOWL,1.25,LIDL
282,FRAPPUCINO SCARF KNITTING KIT,2.95,ASDA
283,WASH BAG VINTAGE ROSE PAISLEY,2.55,Tesco
284,GREEN ROSE WASHBAG,3.75,Tesco
285,BLUE/BROWN DOTS RUFFLED UMBRELLA,5.95,Sainsbury's
286,PINK/BROWN DOTS RUFFLED UMBRELLA,5.95,Sainsbury's
287,AGED GLASS SILVER T-LIGHT HOLDER,0.65,ALDI
288,SILVER HANGING T-LIGHT HOLDER,1.65,Tesco
289,CHOCOLATE THIS WAY METAL SIGN,2.1,ALDI
290,MIRRORED WALL ART POPPIES,2.55,LIDL
291,HAND OVER THE CHOCOLATE SIGN ,2.1,Sainsbury's
292,PAINTED BIRD ASSORTED CHRISTMAS,1.69,ASDA
293,12 PENCILS TALL TUBE POSY,0.85,Sainsbury's
294,12 PENCILS TALL TUBE SKULLS,0.85,ALDI
295,LARGE HEART FLOWERS HOOK ,1.25,Tesco
296,2 DAISIES HAIR COMB,2.95,LIDL
297,ANT WHITE WIRE HEART SPIRAL,3.95,LIDL
298,GREEN VINTAGE EARRINGS ,3.75,LIDL
299,FILIGREE DIAMANTE EARRINGS,4.25,ALDI
300,PINK VINTAGE VICTORIAN EARRINGS,2.95,LIDL
301,BROWN VINTAGE VICTORIAN EARRINGS,2.95,ASDA
302,SILVER HOOP EARRINGS WITH FLOWER,5.95,Sainsbury's
303,RASPBERRY ANT COPPER FLOWER NECKLAC,5.95,Tesco
304,NEW BAROQUE B'FLY NECKLACE RED,8.5,ASDA
305,"FLOWER GLASS GARLAND NECKL.36""BLACK",7.95,ALDI
306,OLD ROSE COMBO BEAD NECKLACE,2.95,LIDL
307,PINK/AMETHYST/GOLD NECKLACE,6.95,ALDI
308,5 STRAND GLASS NECKLACE CRYSTAL,6.35,Sainsbury's
309,PURPLE CURRENT CANDLE RING,0.75,ALDI
310,WHITE CHOCOLATE SCENT CANDLE,1.25,ALDI
311,FOUR HOOK WHITE LOVEBIRDS,2.1,ALDI
312,DOOR MAT NEW ENGLAND,6.75,Tesco
313,DOOR MAT GREEN PAISLEY ,6.75,Tesco
314,GRAND CHOCOLATECANDLE,1.45,ASDA
315,SET/3 DECOUPAGE STACKING TINS,4.95,Sainsbury's
316,GLITTER BUTTERFLY CLIPS,2.55,Tesco
317,RIBBON REEL SPOTS DESIGN ,1.65,Tesco
318,RIBBON REEL STRIPES DESIGN ,1.65,Tesco
319,SHOE SHINE BOX ,9.95,Tesco
320,PARTY METAL SIGN ,1.45,ASDA
321,NO SINGING METAL SIGN,2.1,Tesco
322,12 EGG HOUSE PAINTED WOOD,12.75,Sainsbury's
323,PINK HEART CANDY BUTTON CALCULATOR,2.55,LIDL
324,PAPER BUNTING VINTAGE PAISLEY,2.95,ALDI
325,SILVER MINI TAPE MEASURE ,0.85,ASDA
326,ASSORTED SANTA CHRISTMAS DECORATION,0.85,ASDA
327,NOEL WOODEN BLOCK LETTERS ,5.95,ASDA
328,ZINC METAL HEART DECORATION,1.25,ALDI
329,YELLOW RED FLOWER PIGGY BANK,4.65,Tesco
330,COLOURING PENCILS BROWN TUBE,0.85,Tesco
331,GREY HEART HOT WATER BOTTLE,3.45,LIDL
332,CAMOUFLAGE EAR MUFF HEADPHONES,5.49,LIDL
333,LOCAL CAFE MUG,2.1,Tesco
334,KNITTED UNION FLAG HOT WATER BOTTLE,3.75,ASDA
335,BLUE WHITE SCARF HOT WATER BOTTLE,3.95,LIDL
336,GEISHA GIRL CHOPSTICKS SET/5,1.95,ASDA
337,URBAN CHIC CHOPSTICKS SET/5,1.95,LIDL
338,POTTING SHED TEA MUG,1.25,LIDL
339,KINGS CHOICE MUG,1.25,ALDI
340,EIGHT PIECE DINOSAUR SET,1.25,ASDA
341,EIGHT PIECE CREEPY CRAWLIE SET,1.25,LIDL
342,EIGHT PIECE SNAKE SET,1.25,ASDA
343,RATTLE SNAKE EGGS,1.25,ASDA
344,DINOSAUR KEYRINGS ASSORTED,0.21,LIDL
345,ASSORTED TUTTI FRUTTI NOTEBOOK,2.1,Sainsbury's
346,CAKE STAND LACE WHITE,4.25,Tesco
347,CAKE PLATE LOVEBIRD WHITE,4.95,Tesco
348,COFFEE MUG PINK PAISLEY DESIGN,2.55,Sainsbury's
349,COFFEE MUG BLUE PAISLEY DESIGN,2.55,Sainsbury's
350,COFFEE MUG PEARS DESIGN,2.55,LIDL
351,COFFEE MUG APPLES DESIGN,2.55,ALDI
352,PARTY CONES CARNIVAL ASSORTED,1.25,LIDL
353,ANTIQUE GLASS HEART DECORATION ,1.95,Tesco
354,ASSORTED TUTTI FRUTTI KEYRING,0.85,Tesco
355,ANGEL DECORATION 3 BUTTONS ,0.42,ASDA
356,STAR DECORATION RUSTIC,0.42,LIDL
357,WOODEN BOX OF DOMINOES,1.25,Sainsbury's
358,GREEN CHRISTMAS TREE STRING 20LIGHT,4.95,Sainsbury's
359,RED REINDEER STRING OF 20 LIGHTS,4.95,LIDL
360,COSY HOUR GIANT TUBE MATCHES,2.55,Sainsbury's
361,RETRO SPOT GIANT TUBE MATCHES,2.55,LIDL
362,GLITTER CHRISTMAS HEART ,0.85,Tesco
363,GLITTER CHRISTMAS STAR ,0.85,Sainsbury's
364,GLITTER CHRISTMAS TREE,0.85,Tesco
365,DOOR MAT 3 SMILEY CATS,6.75,Sainsbury's
366,RED SPOTTY COIR DOORMAT,6.75,Sainsbury's
367,DOORMAT HEARTS,6.75,Tesco
368,SKULLS WRAP,0.42,LIDL
369,MINATURE COLOURED GARDENING SET,4.95,ALDI
370,GREEN BLUE FLOWER PIGGY BANK,4.65,ASDA
371,PINK SPOTTY BOWL,1.25,LIDL
372,RED SPOTTY BOWL,1.25,ASDA
373,SET/6 RED SPOTTY PAPER CUPS,0.65,Sainsbury's
374,SET OF 6 CAKE CHOPSTICKS,1.25,ASDA
375,CAMOUFLAGE LED TORCH,1.69,ALDI
376,CHOCOLATE CALCULATOR,1.65,LIDL
377,200 RED + WHITE BENDY STRAWS,1.25,ASDA
378,I CAN ONLY PLEASE ONE PERSON MUG,1.25,ASDA
379,METAL SIGN EMPIRE TEA,2.95,ALDI
380,COOK WITH WINE METAL SIGN ,1.95,Tesco
381,GIN + TONIC DIET METAL SIGN,2.1,Sainsbury's
382,POTTERING IN THE SHED METAL SIGN,1.95,ASDA
383,POPCORN HOLDER SMALL ,0.85,Tesco
384,SET/6 RED SPOTTY PAPER PLATES,0.85,Tesco
385,SET/6 CHRISTMAS ICICLE T-LIGHTS,1.25,Sainsbury's
386,MIRROR MOSAIC T-LIGHT HOLDER ROUND,1.65,ALDI
387,WHITE WITH BLACK CATS MUG,0.85,Sainsbury's
388,PAINTED METAL PEARS ASSORTED,1.69,Tesco
389,RED SPOTTY CUP,0.85,ALDI
390,BLUE SPOTTY CUP,0.85,ASDA
391,PINK SPOTTY CUP,0.85,Tesco
392,MAGIC GARDEN MOUNT FUJI,2.55,Tesco
393,MAGIC SHEEP WOOL GROWING FROM PAPER,2.55,ALDI
394,6 RIBBONS RUSTIC CHARM,1.65,ASDA
395,TRADITIONAL CHRISTMAS RIBBONS,1.25,Sainsbury's
396,SCANDINAVIAN REDS RIBBONS,1.25,Tesco
397,6 RIBBONS ELEGANT CHRISTMAS ,1.65,Tesco
398,6 RIBBONS EMPIRE ,1.65,ASDA
399,LIGHT PINK CHERRY LIGHTS,6.75,Tesco
400,BROWN FLOWER LIGHTS,6.75,ALDI
401,WILLOW BRANCH LIGHTS.,6.75,Tesco
402,PACK OF 60 MUSHROOM CAKE CASES,0.55,ALDI
403,RED SPOTS WRAP ,0.42,Tesco
404,SILVER HANGING T-LIGHT HOLDER DOME,1.65,Sainsbury's
405,RETRO SPOTS PUDDING BOWL,4.25,LIDL
406,RED SPOTTY SHOPPER BAG,1.25,LIDL
407,RETRO SPOTS BUTTER DISH,4.95,Tesco
408,WRAP BLIZZARD,0.42,Sainsbury's
409,RETRO SPOT TRADITIONAL TEAPOT ,7.95,LIDL
410,RETRO SPOT LARGE MILK JUG,4.95,LIDL
411,RETRO SPOT SUGAR JAM BOWL,2.55,LIDL
412,SET/5 RED SPOTTY LID GLASS BOWLS,2.95,Sainsbury's
413,RED SPOTTY PLATE ,1.69,ALDI
414,JIGSAW TOADSTOOLS 3 PIECE,1.65,Tesco
415,RETRO SPOT SMALL MILK JUG,2.55,Sainsbury's
416,RETRO SPOT MUG,2.95,ALDI
417,RETRO SPOT STORAGE JAR,3.75,ALDI
418,TEA CUP AND SAUCER RETRO SPOT,3.75,Sainsbury's
419,EDWARDIAN PARASOL BLACK,5.95,LIDL
420,EDWARDIAN PARASOL NATURAL,5.95,Sainsbury's
421,FELT TOADSTOOL LARGE,1.25,Sainsbury's
422,FELT TOADSTOOL SMALL,0.85,ALDI
423,POLYESTER FILLER PAD 40x40cm,1.45,ASDA
424,POLYESTER FILLER PAD 60x40cm,2.55,ASDA
425,KIDS RAIN MAC BLUE,0.85,ALDI
426,KIDS RAIN MAC PINK,0.85,ASDA
427,RED SPOTTY CHILDS UMBRELLA,3.25,Sainsbury's
428,ZINC WILLIE WINKIE CANDLE STICK,0.85,LIDL
429,CREAM SWEETHEART MAGAZINE RACK,16.95,Tesco
430,DOOR MAT TOPIARY,6.75,LIDL
431,SWALLOWS GREETING CARD,0.42,Sainsbury's
432,SET/20 POSIES PAPER NAPKINS,0.85,Sainsbury's
433,BLUE PAISLEY NOTEBOOK,1.65,ASDA
434,BLUE PAISLEY JOURNAL ,2.55,ASDA
435,PENNY FARTHING BIRTHDAY CARD,0.42,Tesco
436,VIPPASSPORT COVER ,2.1,LIDL
437,SET/10 PINK SPOTTY PARTY CANDLES,1.25,Tesco
438,SET/10 BLUE SPOTTY PARTY CANDLES,1.25,Tesco
439,TROPICAL LUGGAGE TAG,1.25,ASDA
440,WRAP FRIENDSHIP ON GREEN,0.42,ALDI
441,STRAWBERRIES PRINT BOWL,1.25,Sainsbury's
442,PACK 20 ENGLISH ROSE PAPER NAPKINS,0.85,Tesco
443,TROPICAL PASSPORT COVER ,2.1,LIDL
444,UNION JACK FLAG LUGGAGE TAG,1.25,Sainsbury's
445,VIP LUGGAGE TAG ,1.25,ALDI
446,CHRYSANTHEMUM NOTEBOOK,1.65,LIDL
447,GREEN FERN NOTEBOOK,1.65,LIDL
448,ROBOT BIRTHDAY CARD,0.42,LIDL
449,DINOSAUR BIRTHDAY CARD,0.42,Tesco
450,MULTI HEARTS STICKERS,0.85,ASDA
451,SKULLS WATER TRANSFER TATTOOS ,0.85,Sainsbury's
452,ROSE DU SUD CHILDS APRON,4.25,Sainsbury's
453,PINK DRESS JEWELLERY STAND ,2.95,LIDL
454,BLACK STITCHED WALL CLOCK,3.75,LIDL
455,RED GINGHAM ROSE JEWELLERY BOX,1.65,ASDA
456,F FAIRY POTPOURRI CUSHIONS LAVENDER,1.69,ASDA
457,PINK SPOTS WRAP ,0.42,LIDL
458,GREEN GINGHAM FLOWER JEWELLERY BOX,1.65,Tesco
459,KENSINGTON COFFEE SET,12.75,ALDI
460,OCEAN SCENT CANDLE IN JEWELLED BOX,4.25,ALDI
461,GLASS HONEYPOT WASP CATCHER,1.95,LIDL
462,COSY HOUR CIGAR BOX MATCHES ,1.25,Tesco
463,S/4 FESTIVE GREEN DINNER CANDLES,1.25,Sainsbury's
464,REX CASH+CARRY JUMBO SHOPPER,0.95,LIDL
465,BRIGHT BLUES RIBBONS ,1.25,ASDA
466,PACK OF 12 HEARTS DESIGN TISSUES ,0.29,Tesco
467,PACK OF 12 RED SPOTTY TISSUES ,0.29,ALDI
468,RECYCLED PENCIL WITH RABBIT ERASER,0.21,LIDL
469,ROTATING SILVER ANGELS T-LIGHT HLDR,2.55,ALDI
470,60 GOLD AND SILVER FAIRY CAKE CASES,0.55,LIDL
471,STRAWBERRY SCENTED SET/9 T-LIGHTS,0.85,LIDL
472,CINAMMON SET OF 9 T-LIGHTS,0.85,ASDA
473,FROSTED BOX 9 WHITE T-LIGHT CANDLES,0.42,Tesco
474,SMALL RETRO SPOT MUG IN BOX WHITE,3.75,Tesco
475,SMALL RETRO SPOT MUG IN BOX RED,3.75,Sainsbury's
476,ASSTD DESIGN BUBBLE GUM RING,0.21,ASDA
477,ROMANTIC PINKS RIBBONS ,1.25,ASDA
478,SILVER CHRISTMAS TREE BAUBLE STAND ,16.95,LIDL
479,CORONA MEXICAN TRAY,3.75,Tesco
480,MILK PAN RED RETROSPOT,3.75,LIDL
481,SILVER SLEIGHBELL WREATH,7.95,Sainsbury's
482,DAIRY MAID CERAMIC BUTTER DISH,4.25,ASDA
483,DAIRY MAID PUDDING BOWL,3.75,ASDA
484,DAIRY MAID LARGE MILK JUG,4.95,ASDA
485,FRENCH ENAMEL CANDLEHOLDER,2.1,ASDA
486,JOY WOODEN BLOCK LETTERS,4.95,ALDI
487,LARGE CAMPHOR WOOD FIELD MUSHROOM ,5.45,Sainsbury's
488,RED STAR CARD HOLDER,2.95,ALDI
489,ENGLISH ROSE GARDEN SECATEURS,1.95,ASDA
490,ENGLISH ROSE TORCH,1.65,LIDL
491,CHRISTMAS HANGING TREE WITH BELL,1.25,Sainsbury's
492,WHITE DOVE HONEYCOMB PAPER GARLAND,1.65,ALDI
493,SET OF 12 LILY BOTANICAL T-LIGHTS,2.95,ALDI
494,PINK STRIPE HOT WATER BOTTLE,2.95,Tesco
495,SET/6 IVORY BIRD T-LIGHT CANDLES,2.1,Tesco
496,SET/6 SILVER REINDEER T-LIGHTS,1.95,LIDL
497,SET/6 BLACK SNOWFLAKE T-LIGHTS ,1.69,Tesco
498,SLATE TILE NATURAL HANGING,1.65,ALDI
499,RAIN HAT WITH RED SPOTS,0.42,Tesco
500,WISE MAN STAR SHAPE EGG PAN,1.65,ALDI
501,SET 12 KIDS COLOUR CHALK STICKS,0.42,ALDI
502,FEATHER DUSTER COAL BLACK,1.25,Sainsbury's
503,CROCHET BEAR WITH BLUE STRIPES,2.55,Tesco
504,SMALL SKULL WINDMILL,1.25,Sainsbury's
505,72 ROUND PINK DOILIES,1.45,LIDL
506,SET OF 20 KIDS COOKIE CUTTERS,1.95,ALDI
507,BLACK LOVE BIRD T-LIGHT HOLDER,3.75,ALDI
508,STRAWBERRY BATH SPONGE ,1.25,ASDA
509,WATERMELON BATH SPONGE,1.25,ALDI
510,SANDWICH BATH SPONGE,1.25,LIDL
511,ASS COL SMALL SAND FROG P'WEIGHT,0.42,Sainsbury's
512,S/6 WOODEN SKITTLES IN COTTON BAG,2.95,Tesco
513,SET/6 PINK BIRD T-LIGHT CANDLES,2.1,ASDA
514,VANILLA INCENSE IN TIN,1.25,Sainsbury's
515,12 PENCILS SMALL TUBE RED SPOTTY,0.65,ASDA
516,12 MINI TOADSTOOL PEGS,1.25,ALDI
517,PHOTO CUBE,1.65,Tesco
518, 3 STRIPEY MICE FELTCRAFT,1.95,ALDI
519,FELTCRAFT BUTTERFLY HEARTS,1.45,Sainsbury's
520,TOAST ITS - FAIRY FLOWER,1.25,LIDL
521,TOAST ITS - DINOSAUR,1.25,Tesco
522,HEARTS STICKERS,0.85,Tesco
523,WOODLAND STICKERS,0.85,ASDA
524,GLASS STAR FROSTED T-LIGHT HOLDER,4.95,Tesco
525,HI TEC ALPINE HAND WARMER,1.65,ASDA
526,LOVE HEART POCKET WARMER,1.65,Sainsbury's
527,ASSORTED TUTTI FRUTTI BRACELET,0.65,Tesco
528,TRADITIONAL WOODEN CATCH CUP GAME ,1.25,LIDL
529,SET/6 3D KIT CARDS FOR KIDS,0.85,Sainsbury's
530,QUEEN OF SKIES LUGGAGE TAG,1.25,LIDL
531,MODERN FLORAL STATIONERY SET,2.95,Tesco
532,SKULL SHOULDER BAG,1.65,ASDA
533,WOODLAND DESIGN COTTON TOTE BAG,2.25,Tesco
534,LOLITA DESIGN COTTON TOTE BAG,2.25,Sainsbury's
535,SAVE THE PLANET COTTON TOTE BAG,2.25,ALDI
536,JUMBO BAG OWLS,1.95,Sainsbury's
537,JUMBO BAG WOODLAND ANIMALS,1.95,Sainsbury's
538,POP ART PEN CASE & PENS,0.85,ASDA
539,DINOSAUR LUNCHBOX WITH CUTLERY,2.55,Sainsbury's
540,SILVER FINCH DECORATION,1.25,ASDA
541, BLACK PIRATE TREASURE CHEST,1.65,Sainsbury's
542,SMALL CAMPHOR WOOD FIELD MUSHROOM,1.65,ALDI
543, CAMPHOR WOOD PORTOBELLO MUSHROOM,1.25,LIDL
544,PORCELAIN T-LIGHT HOLDERS ASSORTED,1.25,Sainsbury's
545,BIRD BOX CHRISTMAS TREE DECORATION,0.85,ASDA
546,SET/6 BLACK GLITTER REINDEER CANDLE,2.1,Sainsbury's
547,CHARLOTTE BAG SUKI DESIGN,0.85,LIDL
548,SKULLS DESIGN COTTON TOTE BAG,2.25,ASDA
549,LUNCH BAG BLACK SKULL.,1.65,Sainsbury's
550,VINTAGE BILLBOARD DRINK ME MUG,1.25,ASDA
551,VINTAGE BILLBOARD LOVE/HATE MUG,1.25,Sainsbury's
552,CREAM HEART CARD HOLDER,3.95,Tesco
553,DOOR MAT SWEET HOME,6.75,LIDL
554,DOOR MAT WELCOME PUPPIES,6.75,ALDI
555,DOOR MAT ENGLISH ROSE ,6.75,Sainsbury's
556,RECIPE BOX WITH METAL HEART,7.95,ALDI
557,RED FLORAL FELTCRAFT SHOULDER BAG,3.75,LIDL
558,GREEN FLORAL FELTCRAFT SHOULDER BAG,3.75,Sainsbury's
559,SET 3 WICKER LOG BASKETS,19.95,Sainsbury's
560,YELLOW PURPLE DAISY FELT PURSE KIT,1.25,Sainsbury's
561,YELLOW FLOWERS FELT HANDBAG KIT,2.1,Sainsbury's
562,FRYING PAN UNION FLAG,4.25,ASDA
563,LIGHT BIRD HOUSE TREE DECORATION,0.85,ASDA
564,GLITTER HANGING BUTTERFLY STRING,2.1,Tesco
565,ORANGE SCENTED SET/9 T-LIGHTS,0.85,ALDI
566,BROWN CHECK CAT DOORSTOP ,4.25,LIDL
567,4 IVORY DINNER CANDLES GOLD FLOCK,2.55,ASDA
568,FLORAL FOLK STATIONERY SET,2.95,Sainsbury's
569,PINK HEART DOTS HOT WATER BOTTLE,3.75,Tesco
570,GARLAND WITH STARS AND BELLS,4.95,ALDI
571,GARLAND WITH HEARTS AND BELLS,4.95,ASDA
572,RED WHITE SCARF HOT WATER BOTTLE,3.95,ASDA
573,STRING OF 8 BUTTERFLIESPINK,1.65,ASDA
574,4 IVORY DINNER CANDLES SILVER FLOCK,2.55,ALDI
575,S/4 BURGUNDY WINE DINNER CANDLES,1.25,ALDI
576,S/4 FESTIVE RED DINNER CANDLES,1.25,ASDA
577,RED HANGING METAL STAR TLIGHT HLDR,3.39,ASDA
578,SET/4 PINK ORCHID CANDLES IN BOWL,1.45,ASDA
579,SET/4 BLUE FLOWER CANDLES IN BOWL,1.45,ALDI
580,FUNKY MONKEY MUG,0.85,LIDL
581,BIG DOUGHNUT FRIDGE MAGNETS,0.85,LIDL
582,FLORAL ELEPHANT SOFT TOY,3.75,ALDI
583,SLEEPING CAT ERASERS,0.21,ALDI
584,BLACK AND WHITE PAISLEY FLOWER MUG,0.85,Sainsbury's
585,GREETING CARD RITA,0.19,ALDI
586,SET/20 RED SPOTTY PAPER NAPKINS ,0.85,Sainsbury's
587,PACK OF 12 SKULL TISSUES,0.29,Tesco
588,BIRD HOUSE HOT WATER BOTTLE,3.45,ASDA
589,WIRE FLOWER T-LIGHT HOLDER,1.25,Sainsbury's
590,ASSORTED FRAGRANCE BATH CONFETTI,0.42,Tesco
591,PLACE SETTING WHITE STAR,0.42,Tesco
592,PREMIUM CHURCH CANDLE,2.1,LIDL
593,RIBBON REEL FLORA + FAUNA ,1.65,ALDI
594,RIBBON REEL HEARTS DESIGN ,1.65,Sainsbury's
595,ABSTRACT CIRCLES POCKET BOOK,0.85,LIDL
596,GREEN FERN POCKET BOOK,0.85,ASDA
597,SET OF 6 GIRLS CELEBRATION CANDLES,1.25,Tesco
598,SET 6 FOOTBALL CELEBRATION CANDLES,1.25,LIDL
599,MIRROR MOSAIC T-LIGHT HOLDER ,1.65,LIDL
600,SMALL FOLKART CHRISTMAS TREE DEC,0.42,Sainsbury's
