601,SMALL FOLKART STAR CHRISTMAS DEC,0.42,ASDA
602,SMALLFOLKART BAUBLE CHRISTMAS DEC,0.42,Sainsbury's
603,PINK HEART SHAPE EGG FRYING PAN,1.65,ASDA
604,ENGLISH ROSE DESIGN PEG BAG,2.1,ASDA
605,PINK 3 TIER GLASS PLATE STAND,12.75,Sainsbury's
606,GREEN 3 TIER GLASS PLATE STAND,12.75,ASDA
607,FAMILY ALBUM WHITE PICTURE FRAME,8.5,ASDA
608,LARGE GREEN PEONY FOLDING STOOL,2.1,ASDA
609,LARGE PINK PEONY FOLDING STOOL,2.1,ASDA
610,FRYING PAN BLUE POLKADOT ,4.25,ALDI
611,TEA TIME CAKE STAND IN GIFT BOX,10.75,LIDL
612,SWALLOW CIGAR BOX MATCHES ,1.25,Sainsbury's
613,PAPER CHAIN KIT SKULLS ,2.95,ASDA
614,JUMBO BAG BAROQUE BLACK WHITE,1.95,LIDL
615,TEA BAG PLATE RED SPOTTY ,0.85,Tesco
616,WHITE JEWELLED HEART DECORATION,0.64,ALDI
617,MA CAMPAGNE CUTLERY BOX,14.95,LIDL
618,GREEN FERN JOURNAL ,2.55,LIDL
619,SET/20 FRUIT SALAD PAPER NAPKINS ,0.85,ALDI
620,SCOTTIES DES CHILD'S APRON,1.65,LIDL
621,SMALL HEART MEASURING SPOONS,0.85,ALDI
622,S/16 VINTAGE PISTACHIO CUTLERY,12.75,ALDI
623,S/16 VINTAGE SKY BLUE CUTLERY,12.75,ASDA
624,S/16 VINTAGE IVORY CUTLERY,12.75,Sainsbury's
625,LAVENDER SCENTED SET/9 T-LIGHTS,0.85,Tesco
626,4 WILDFLOWER BOTANICAL CANDLES,3.75,Tesco
627,4 LAVENDER BOTANICAL DINNER CANDLES,3.75,Tesco
628,4 VANILLA BOTANICAL CANDLES,3.75,ALDI
629,SET 12 WILDFLOWER BOTANICAL T-LIGHT,2.95,ASDA
630,LUSH GREENS RIBBONS,1.25,Sainsbury's
631,CHOCOLATE BOX RIBBONS ,1.25,ASDA
632,OPEN CLOSED METAL SIGN,4.95,Tesco
633,TEA TIME TEAPOT IN GIFT BOX,9.95,Tesco
634,ASSORTED SANSKRIT MINI NOTEBOOK,1.25,LIDL
635,KEY FOB BACK DOOR ,0.65,Tesco
636,KEY FOB SHED,0.65,LIDL
637,KEY FOB FRONT DOOR ,0.65,Sainsbury's
638,SET/4 BADGES WOODLAND ANIMAL,1.25,ALDI
639,URBAN BLACK RIBBONS ,1.25,Sainsbury's
640,LETS GO SHOPPING COTTON TOTE BAG,2.25,ASDA
641,RABBIT DESIGN COTTON TOTE BAG,2.25,Tesco
642,BLUE ROSE FABRIC MIRROR,1.25,ASDA
643,PINK ROSE FABRIC MIRROR,1.25,Sainsbury's
644,36 PENCILS TUBE RED SPOTTY,1.25,Sainsbury's
645,12 PENCILS TALL TUBE RED SPOTTY,0.85,ASDA
646,12 PENCILS TALL TUBE WOODLAND,0.85,ASDA
647,36 PENCILS TUBE WOODLAND,1.25,LIDL
648,12 PENCILS SMALL TUBE SKULL,0.65,LIDL
649,LAVENDER SCENTED FABRIC HEART,1.25,ASDA
650,SET/3 POLKA DOT STACKING TINS,4.95,ASDA
651,ROSE FOLKART HEART DECORATIONS,1.25,LIDL
652,COSY SLIPPER SHOES LARGE RED,2.95,LIDL
653,VINTAGE UNION JACK DOORSTOP,5.95,ASDA
654,COSY SLIPPER SHOES SMALL RED ,2.95,ASDA
655,POCKET BAG PINK PAISELY BROWN SPOT,2.1,ALDI
656,BABY MOUSE RED GINGHAM DRESS,4.25,ALDI
657,VINTAGE UNION JACK BUNTING,8.5,ALDI
658,VINTAGE UNION JACK CUSHION COVER,4.95,Tesco
659, RED/WHITE DOT MINI CASES,7.95,Sainsbury's
660,WOODEN PICTURE FRAME WHITE FINISH,2.55,Tesco
661,RED SPOTTY PURSE ,2.95,Tesco
662,WHITE SWEETHEARTS CABINET 4 DRAWERS,12.75,ALDI
663,BASKET OF TOADSTOOLS,1.25,Sainsbury's
664,WRAP WINTER FOREST,0.42,Tesco
665,WRAP BLUE REINDEER,0.42,LIDL
666,RED BIRD HOUSE TREE DECORATION,0.72,Tesco
667,SET OF 72 RETRO SPOT PAPER DOILIES,1.45,Tesco
668,RED SPOTTY SHOPPING BAG,2.55,LIDL
669,SET OF 3 CASES WOODLAND DESIGN,5.95,Tesco
670,WOODLAND STORAGE BOX LARGE ,2.95,Tesco
671,WOODLAND STORAGE BOX SMALL,2.1,Tesco
672,TRADITIONAL WOODEN SKIPPING ROPE,1.25,ASDA
673,CHRISTMAS TOILET ROLL,1.25,ASDA
674,WHITE TISSUE REAM,7.95,LIDL
675,ASS COL LARGE SAND FROG P'WEIGHT,0.85,ALDI
676,ASS COL LARGE SAND GECKO P'WEIGHT,0.85,ASDA
677,SET/12 FUNKY FELT FLOWER PEG IN BAG,2.1,Tesco
678,PINK CRYSTAL HEART PHONE CHARM,0.85,Tesco
679,BLUE CRYSTAL BOOT PHONE CHARM,0.85,LIDL
680,WRAP SPEED DEMONS ,0.1,Sainsbury's
681,BUDDHA INCENSE HOLDER ASSORTED,0.85,LIDL
682,FLOWER FAIRY SUMMER BOUQUET SACHET,0.42,Sainsbury's
683,WHITE CHRISTMAS TREE DECORATION ,0.42,ASDA
684,PINK BERTIE GLASS BEAD BAG CHARM,2.1,LIDL
685,ELEPHANT TOY WITH BLUE T-SHIRT,3.75,ALDI
686,BLACK FACE LAMB WITH PANTS,3.75,ALDI
687,PINK STAR CHRISTMAS DECORATION,0.38,Tesco
688,PINK STOCKING CHRISTMAS DECORATION,0.38,ASDA
689,CRYSTAL SEA HORSE PHONE CHARM,0.85,Sainsbury's
690,CRYSTAL STILETTO PHONE CHARM,0.85,LIDL
691,CLEAR CRYSTAL STAR PHONE CHARM,0.85,LIDL
692,PINK CRYSTAL GUITAR PHONE CHARM,0.85,Tesco
693,CRYSTAL KEY+LOCK PHONE CHARM,0.85,LIDL
694,WHITE CHRISTMAS STAR DECORATION,0.42,LIDL
695,WHITE CHRISTMAS HEART DECORATION,0.42,Tesco
696, STAR T-LIGHT HOLDER ,1.45,Tesco
697,CHRISTMAS TREE T-LIGHT HOLDER,1.45,Sainsbury's
698,PINK BEADED CONE CHRISTMAS,0.42,LIDL
699,ANGEL DECORATION STARS ON DRESS,0.42,LIDL
700,SET/6 GINGERBREAD STAR T-LIGHTS,1.25,ASDA
701,SET/3 CHRISTMAS DECOUPAGE CANDLES,1.25,ASDA
702,6 CHOCOLATE LOVE HEART T-LIGHTS,2.1,Tesco
703,36 PENCILS TUBE SKULLS,1.25,Tesco
704,SET/6 GINGERBREAD TREE T-LIGHTS,1.25,Tesco
705,3D SHEET OF DOG STICKERS,0.85,ALDI
706,TOP SECRET PEN SET,1.25,Tesco
707,JAZZ HEARTS SPIRAL NOTEPAD,0.85,ALDI
708,JAZZ HEARTS PURSE NOTEBOOK,0.85,ALDI
709,JAPANESE CROCHETED ANIMAL,0.42,ALDI
710,WORLD WAR 2 GLIDERS ASSTD DESIGNS,0.21,ASDA
711,BROWN FURRY HOT WATER BOTTLE,3.75,LIDL
712,DOVE DECORATION PAINTED ZINC ,0.65,LIDL
713,HEART DECORATION WITH PEARLS ,0.85,LIDL
714,STAR DECORATION PAINTED ZINC ,0.65,ALDI
715,PAINTED METAL TREE WITH HOLLY BELLS,1.45,ASDA
716,GLITTER CHRISTMAS TREE WITH BELLS,1.95,ALDI
717,COSMETIC BAG VINTAGE ROSE PAISLEY,2.1,Tesco
718,SIX STRING SCANDINAVIAN HEART DECS,2.95,ASDA
719,PARTY BUNTING,4.65,LIDL
720,MOROCCAN BEATEN METAL DISH,9.95,Tesco
721,STRING OF 20 ROSE LIGHTS,12.75,ALDI
722,WHITE BEADED GARLAND STRING 20LIGHT,6.35,Sainsbury's
723,PINK SPOTTY CHILDS UMBRELLA,3.25,Tesco
724,NEW BAROQUE WALL MIRROR,12.75,ASDA
725,PINK AND LILAC QUILTED THROW ,45.95,ALDI
726,PINK PAISLEY CUSHION COVER ,5.95,Sainsbury's
727,WHITE ROSE C/COVER,5.95,Sainsbury's
728,MOUSE TOY WITH PINK T-SHIRT,3.75,LIDL
729,PINK GINGHAM ROSE CUSHION COVER,5.95,Tesco
730,PLACE SETTING WHITE HEART,0.42,LIDL
731,12 ASS ZINC CHRISTMAS DECORATIONS,2.1,ASDA
732,ANGEL DECORATION PAINTED ZINC ,0.65,Tesco
733,TURQUOISE BERTIE GLASS BEAD CHARM,2.1,ALDI
734,PURPLE BERTIE GLASS BEAD BAG CHARM,2.1,Tesco
735,"LETTER ""H"" BLING KEY RING",1.25,Tesco
736,VINTAGE KEEPSAKE BOX PINK FLOWER,6.35,ALDI
737,METAL SHELF WITH RAIL ,8.5,ALDI
738,CREAM SWEETHEART WALL CABINET,18.95,Sainsbury's
739,RED SPOTTY CHILDS APRON,1.95,ALDI
740,COLUMBIAN CANDLE ROUND ,1.25,Sainsbury's
741,72 SWEETHEART FAIRY CAKE CASES,0.55,Tesco
742,ASSTD FRUIT+FLOWERS FRIDGE MAGNETS,0.55,LIDL
743,ASSORTED TUTTI FRUTTI PHOTO FRAME,2.95,LIDL
744,MIRRORED DISCO BALL ,5.95,Sainsbury's
745,SILVER RETRODISC LAMPSHADE,9.95,LIDL
746,WOOD AND GLASS MEDICINE CABINET,29.95,Sainsbury's
747,SWEETHEART KEY CABINET,6.75,ALDI
748,CREAM SWEETHEART LETTER RACK,5.45,ALDI
749,PINK FLOCK TABLE CLOCK ,8.95,Tesco
750,WHITE CHRISTMAS GARLAND STARS TREES,3.75,Sainsbury's
751,ROSE 1 WICK MORRIS BOXED CANDLE,4.25,Tesco
752,HEART GARLAND RUSTIC PADDED,2.95,Sainsbury's
753,HEART IVORY TRELLIS SMALL,1.25,ALDI
754,SILVER GLASS T-LIGHT SET,2.95,ASDA
755,SET OF 4 DIAMOND NAPKIN RINGS,12.75,ALDI
756,HANGING BAUBLE T-LIGHT HOLDER LARGE,2.95,ALDI
757,BLUE PILLAR CANDLE SILVER FLOCK,2.95,Sainsbury's
758,COSY SLIPPER SHOES LARGE GREEN,2.95,Sainsbury's
759,CHARLIE+LOLA MY ROOM DOOR SIGN,2.55,ALDI
760,PANDA AND BUNNIES STICKER SHEET,0.85,LIDL
761,SPOTTY HOME SWEET HOME DOORMAT,6.75,Sainsbury's
762,DOOR MAT BIRD ON THE WIRE,6.75,ALDI
763,BEACH HUT PHOTO FRAME,2.55,ALDI
764,EMBOSSED FLOWER TRELLIS PHOTO FRAME,2.55,LIDL
765,VINTAGE CARAVAN GREETING CARD ,0.42,Tesco
766,VINTAGE KID DOLLY CARD ,0.42,ASDA
767,TEA PARTY BIRTHDAY CARD,0.42,Sainsbury's
768,FRENCH ENAMEL WATER BASIN,3.75,Tesco
769,PINK FLOWER CROCHET FOOD COVER,3.75,LIDL
770,RED FLOWER CROCHET FOOD COVER,3.75,LIDL
771,CHERRY CROCHET FOOD COVER,3.75,ASDA
772,STRAWBERRY RAFFIA FOOD COVER,3.75,ASDA
773,SMALL GLASS HEART TRINKET POT,2.1,Tesco
774,HEART SHAPED MIRROR,1.69,ASDA
775,SET OF 6 STRAWBERRY CHOPSTICKS,1.25,Tesco
776,SET OF 6 HEART CHOPSTICKS,1.25,Tesco
777,DAIRY MAID TRADITIONAL TEAPOT ,6.95,LIDL
778,CERAMIC BIRDHOUSE FINCH BLUE ROOF,2.95,Sainsbury's
779,SMALL MEDINA STAMPED METAL BOWL ,0.85,ALDI
780,CERAMIC BIRDHOUSE RED ROOF SMALL,2.95,ASDA
781,CERAMIC BIRDHOUSE BUTTERFLY SMALL,2.95,ASDA
782,CERAMIC BIRDHOUSE CRESTED TIT SMALL,2.95,Sainsbury's
783,FRENCH ENAMEL POT W LID,2.95,LIDL
784,DAIRY MAID SUGAR JAM BOWL,2.1,ASDA
785,DAIRY MAID CERAMIC TOASTRACK,2.95,ALDI
786,YELLOW BREAKFAST CUP AND SAUCER,2.95,ASDA
787,BLUE BREAKFAST CUP AND SAUCER ,2.95,Sainsbury's
788,CHRISTMAS CARD SINGING ANGEL,0.42,Tesco
789,PACK/12 BLUE REINDEER CARD,2.95,LIDL
790,ROBIN CHRISTMAS CARD,0.42,ALDI
791,S/15 SILVER GLASS BAUBLES IN BAG,1.25,Sainsbury's
792,GLASS HEART T-LIGHT HOLDER ,0.85,ASDA
793,ENGLISH ROSE PLACEMATS,3.75,LIDL
794,SET OF 4 ENGLISH ROSE COASTERS,1.25,ALDI
795,LARGE FIBRE OPTIC CHRISTMAS TREE,2.55,ASDA
796,VINTAGE UNION JACK APRON,6.95,Sainsbury's
797,WHITE ROUND PORCELAIN TLIGHT HOLDER,2.55,ASDA
798,JARDIN ETCHED GLASS CANDLEHLDR LONG,4.95,ASDA
799,PINK BREAKFAST CUP AND SAUCER ,2.95,LIDL
800,FRENCH ENAMEL UTENSIL HOLDER,3.75,Tesco
801,FRENCH CHATEAU LARGE FRUIT BOWL ,7.95,LIDL
802,FRENCH CHATEAU SMALL FRUITBOWL,4.95,LIDL
803,SET OF 72 IVORY PAPER DOILIES,1.45,Tesco
804,SET OF 72 BLACK PAPER DOILIES ,1.45,Tesco
805,SET OF 72 GREEN PAPER DOILIES,1.45,Tesco
806,SET/6 BEAD COASTERS GAUZE BAG GOLD,1.25,ASDA
807,GARDEN METAL SIGN ,1.65,ALDI
808,VINTAGE BILLBOARD MUG ,1.25,Tesco
809,VINTAGE RED MUG,1.25,ASDA
810,VINTAGE RED TEATIME MUG,1.25,Sainsbury's
811,VINTAGE BILLBOARD TEA MUG,1.25,ALDI
812,PACK OF 12 PINK SPOT TISSUES ,0.29,ASDA
813,MOBILE VINTAGE HEARTS ,4.95,ASDA
814,SET/6 GARDEN GNOME T-LIGHT CANDLES,2.95,LIDL
815,SET/4 GARDEN ROSE DINNER CANDLE,1.65,LIDL
816,CHERRY DESIGN PAPERLANTERNS,1.95,ASDA
817,TEA TIME PAPER LANTERNS,1.95,ASDA
818,SEWING SUSAN 21 NEEDLE SET,0.85,ASDA
819,POTTING SHED SEED TIN,4.25,ALDI
820,GAOLERS KEYS DECORATIVE GARDEN ,3.75,LIDL
821,LOVE POTION MASALA INCENSE,0.21,ASDA
822,PINK GLASS CANDLEHOLDER,2.95,ALDI
823,COCKLE SHELL DISH,2.1,Sainsbury's
824,PAPER BUNTING COLOURED LACE,2.95,LIDL
825,MOTORING TISSUE BOX,1.25,LIDL
826,SET/2 BLUE NOODLE BASKETS,1.95,ASDA
827,HANGING FAIRY CAKE DECORATION,2.1,LIDL
828,FROG CANDLE,1.25,ASDA
829,CERAMIC BIRDHOUSE FINCH BLUE LARGE,5.95,LIDL
830,CERAMIC BIRDHOUSE RED ROOF LARGE,5.95,ASDA
831,CAKE STAND WHITE TWO TIER LACE,8.5,ASDA
832,GLASS CHICKEN BUTTER DISH,1.65,Sainsbury's
833,FIRST AID TIN,3.25,Tesco
834,DARK BIRD HOUSE TREE DECORATION,0.85,ASDA
835,SWISS CHALET TREE DECORATION ,0.85,LIDL
836,SET 12 KIDS WHITE CHALK STICKS,0.42,LIDL
837, BROWN PIRATE TREASURE CHEST ,1.65,Sainsbury's
838,BLUE FAIRY CAKE CHILD'S APRON,1.95,LIDL
839,STAR PORTABLE TABLE LIGHT ,2.95,ALDI
840,SNOWFLAKE PORTABLE TABLE LIGHT ,2.95,Sainsbury's
841,IVORY HANGING DECORATION HEART,0.85,ASDA
842,JUMBO BAG STRAWBERRY,1.95,ASDA
843,HAND OPEN SHAPE GOLD,4.25,Tesco
844,BLOKEY SILVER TOOL SET,4.95,ALDI
845,GIRLY PINK TOOL SET,4.95,Tesco
846,SET 3 RED SPOT TIN TEACOFFEESUGAR,4.95,LIDL
847,PINK SPOTTY PLATE ,1.69,LIDL
848,RED SPOTTY PEG BAG,2.1,Sainsbury's
849,VINTAGE GOLD TINSEL REEL,2.1,ASDA
850,IVORY PILLAR CANDLE GOLD FLOCK,2.95,Sainsbury's
851,IVORY PILLAR CANDLE SILVER FLOCK,2.95,LIDL
852,PINK PILLAR CANDLE SILVER FLOCK,2.95,ASDA
853,BLUE SPOTS WRAP,0.42,Sainsbury's
854,RED SPOTTY BIG BOWL,4.95,ASDA
855,SET OF RED SALAD SERVERS ,1.49,ASDA
856,RED SHARK HELICOPTER,7.95,Sainsbury's
857,RED SPOTTY BISCUIT TIN,3.75,Tesco
858,PACK OF 60 DINOSAUR CAKE CASES,0.55,ALDI
859,PACK OF 72 SKULL CAKE CASES,0.55,LIDL
860,PURPLE PILLAR CANDLE BLACK FLOCK,2.95,ASDA
861,SINGLE HEART ZINC T-LIGHT HOLDER,0.95,ASDA
862,WALL MOUNTED VINTAGE ORGANISER,14.95,ASDA
863,ORIENTAL RED C/COVER ,4.25,Sainsbury's
864,RED ROSE AND LACE C/COVER,2.95,LIDL
865,NEW BAROQUE IVORY CUSHION COVER ,2.95,Sainsbury's
866,S/4 CACTI CANDLES,4.95,Sainsbury's
867,SILVER BLUE EGG T-LIGHT HOLDER,1.65,ALDI
868,COLOUR GLASS T-LIGHT HOLDER HANGING,0.65,ASDA
869,HAPPY ANNIVERSARY CANDLE LETTERS,0.42,LIDL
870,ASSORTED COLOUR T-LIGHT HOLDER,0.85,Sainsbury's
871,CACTI T-LIGHT CANDLES,0.42,Tesco
872,ROSES WHITE ROUND CANDLE,0.38,LIDL
873,TABLE LAMP WHITE SHADE WOOD BASE,4.65,ASDA
874,LIBRARY LAMP,21.95,LIDL
875,HAND OPEN SHAPE DECO.WHITE,2.95,Sainsbury's
876,6 HOOK JEWELLERY STAND BLACK DRESS,1.95,Sainsbury's
877,S/3 FLWR FAIRY LILLY CANDLES,2.1,ASDA
878,F.FAIRY S/3 CANDLE/GLASS ROSE,1.95,LIDL
879,S/4 GROOVY CAT MAGNETS,1.65,ALDI
880,SMALL PINK MAGIC CHRISTMAS TREE,0.85,LIDL
881,WOOD STAMP SET FLOWERS,1.65,LIDL
882,6 EGG HOUSE PAINTED WOOD,7.95,Tesco
883,GREEN CHRISTMAS TREE CARD HOLDER,4.25,ALDI
884,TWO DOOR CURIO CABINET,12.75,Tesco
885,WELCOME WOODEN BLOCK LETTERS,9.95,LIDL
886,DOOR MAT FRIENDSHIP ,6.75,ASDA
887,DOOR MAT MULTICOLOUR STRIPE,6.75,ASDA
888,VICTORIAN SEWING BOX MEDIUM,7.95,ASDA
889,FRENCH STYLE WIRE DOOR CABINET ,29.95,LIDL
890,CREAM SWEETHEART SHELF + HOOKS,7.95,ALDI
891,3 HOOK PHOTO SHELF ANTIQUE WHITE,8.5,Sainsbury's
892,SET/6 PURPLE BUTTERFLY T-LIGHTS,2.1,Tesco
893,JELLY BABIES YELLOW SMALL BOWL,1.25,ASDA
894,SMALL LICORICE DES PINK BOWL,1.25,LIDL
895,SMALL CHOCOLATES PINK BOWL,1.25,ASDA
896,CERAMIC CAKE DESIGN SPOTTED MUG,1.49,Tesco
897,FOOD CONTAINER SET 3 LOVE HEART ,1.95,Tesco
898,CERAMIC CAKE DESIGN SPOTTED PLATE,1.49,ASDA
899,MINI CAKE STAND HANGING STRAWBERY,1.65,Sainsbury's
900,CERAMIC BOWL WITH LOVE HEART DESIGN,2.95,ASDA
901,SMALL DOLLY MIX DESIGN ORANGE BOWL,1.25,Tesco
902,PIZZA SLICE DISH,1.25,LIDL
903,BLUE CIRCLES DESIGN MONKEY DOLL,2.55,Tesco
904,CAMOFLAGE DESIGN TEDDY,2.55,Tesco
905,ART LIGHTSFUNK MONKEY,2.95,LIDL
906,TEA TIME MUG IN GIFT BOX,2.95,ALDI
907,FAIRY CAKE NOTEBOOK A5 SIZE,0.85,LIDL
908,FAIRY CAKES NOTEBOOK A6 SIZE,0.65,Tesco
909,FAIRY CAKES NOTEBOOK A7 SIZE,0.42,ALDI
910,CANDY SPOT APRON,4.65,Tesco
911,SET/10 RED SPOTTY PARTY CANDLES,1.25,ALDI
912,BEADED LOVE HEART JEWELLERY SET,0.85,ASDA
913,BUTTERFLY WATER TRANSFER TATTOOS ,0.85,LIDL
914,ASSORTED TUTTI FRUTTI PEN,0.85,LIDL
915,RED ORGANIC CANDLE IN GLASS,1.25,ASDA
916,BOX OF 9 PEBBLE CANDLES,1.95,ALDI
917,HYACINTH BULB T-LIGHT CANDLES,0.42,Sainsbury's
918,POLKA DOT RAFFIA FOOD COVER,3.75,Sainsbury's
919,POTTING SHED CANDLE CITRONELLA,2.95,LIDL
920,POTTING SHED ROSE CANDLE,2.95,Sainsbury's
921,CHRYSANTHEMUM JOURNAL,2.55,Tesco
922,3 WICK CHRISTMAS BRIAR CANDLE ,3.75,ASDA
923,ENGLISH ROSE TAPE MEASURE,1.25,Tesco
924,SET OF 36 SILVER PAPER DOILIES,1.45,Sainsbury's
925,STRAWBERRY DREAM CHILDS UMBRELLA,3.25,ALDI
926,SET 4 NURSERY DES ROUND BOXES,2.95,Sainsbury's
927,SMALL HANGING IVORY/RED WOOD BIRD,0.42,ALDI
928,LARGE HANGING IVORY & RED WOOD BIRD,0.65,LIDL
929,CERAMIC STRAWBERRY MONEY BOX,2.55,ASDA
930,PINK HEARTS PHOTO ALBUM,8.5,Sainsbury's
931,HOME SWEET HOME METAL SIGN ,2.95,Sainsbury's
932,RETRO SPOT CAKE STAND,10.95,Sainsbury's
933,ENGLISH ROSE SCISSORS,1.25,ALDI
934,ASSTD DESIGN POP ART SLIM PEN,0.85,Tesco
935,BEWARE OF THE CAT METAL SIGN ,1.69,LIDL
936,HOME SWEET HOME MUG,1.25,ASDA
937,RED SPOTTY COFFEE MUG,2.1,Tesco
938,WRAPSUKI AND FRIENDS,0.42,ASDA
939,FANCY FONTS BIRTHDAY WRAP,0.42,ALDI
940,BLUE SCANDINAVIAN PAISLEY WRAP,0.42,ASDA
941,METAL SIGN HER DINNER IS SERVED ,2.95,ASDA
942,METAL SIGN HIS DINNER IS SERVED,2.95,Tesco
943,RED SPOTTY APRON ,5.95,ASDA
944,DIAMANTE HEART SHAPED WALL MIRROR ,12.75,ASDA
945,POLYESTER FILLER PAD 65CMx65CM,4.25,ALDI
946,POLYESTER FILLER PAD 45x45cm,1.55,ALDI
947,MEDINA STAMPED METAL TRAY ,14.95,Sainsbury's
948,WHITE STITCHED CUSHION COVER,6.95,ALDI
949,BOX OF 6 PEBBLE CANDLES,3.45,ALDI
950,SILVER LATTICE VANILLA CANDLE POT,3.75,LIDL
951,SILVER VANILLA FLOWER CANDLE POT,3.75,ASDA
952,HEART T-LIGHT HOLDER ,1.45,ALDI
953,TEA TIME TABLE CLOTH,10.65,Tesco
954,DINOSAURS WATER TRANSFER TATTOOS ,0.85,Tesco
955,FEATHER PENCOAL BLACK,0.85,LIDL
956,ECONOMY LUGGAGE TAG,1.25,Sainsbury's
957,RED SPOTTY LUGGAGE TAG,1.25,Sainsbury's
958,TOAST ITS - I LOVE YOU ,1.25,ASDA
959,SET OF 3 HEART COOKIE CUTTERS,1.25,ALDI
960,SET OF 3 BUTTERFLY COOKIE CUTTERS,1.25,Tesco
961,SET/3 OCEAN SCENT CANDLE JEWEL BOX,4.25,Tesco
962,SET/3 CHRISTMAS BRIAR CANDLES,3.75,Tesco
963,SMALL ROUND CUT GLASS CANDLESTICK,4.95,ALDI
964,LARGE ROUND CUTGLASS CANDLESTICK,6.75,Tesco
965,WHITE ADVENT CANDLE,2.12,ASDA
966,SET OF 3 BLUE STRIPE BASKET,12.75,ASDA
967,SET OF 3 RED STRIPE BASKETS,12.75,ALDI
968,ASSORTED COLOURS SILK FAN,0.65,ASDA
969,LARGE ROUND WICKER PLATTER ,5.95,Tesco
970,SET/4 BADGES CUTE CREATURES,1.25,Sainsbury's
971,3D SHEET OF CAT STICKERS,0.85,Sainsbury's
972,3D SHEET OF SEA WORLD STICKERS,0.85,ALDI
973,EDWARDIAN PARASOL PINK,5.95,LIDL
974,GLOW IN DARK DOLPHINS,0.21,Tesco
975,BROCADE RING PURSE ,0.21,LIDL
976,PAPER POCKET TRAVELING FAN ,0.14,ALDI
977,PARTY TIME PENCIL ERASERS,0.21,Tesco
978,IVORY ROSE LAMPSHADE ,1.25,Tesco
979,DOGGY RUBBER,0.21,LIDL
980,ASS COL SMALL SAND GECKO P'WEIGHT,0.42,Sainsbury's
981,MAGIC TREE -PAPER FLOWERS,0.85,ASDA
982,STRAWBERRY CHARLOTTE BAG,0.85,LIDL
983,TEA TIME TEA TOWELS ,2.95,ALDI
984,PINK SMALL GLASS CAKE STAND,1.95,LIDL
985,SET OF 36 TEATIME PAPER DOILIES,1.45,ASDA
986,SET OF 3 CONEY ISLAND OVAL BOXES,4.95,ASDA
987,S/4 VALENTINE DECOUPAGE HEART BOX,2.95,LIDL
988,PINK OVAL JEWELLED MIRROR,5.95,LIDL
989,BLUE VICTORIAN FABRIC OVAL BOX,0.42,ASDA
990,HOT BATHS METAL SIGN,2.1,Sainsbury's
991,KITCHEN METAL SIGN,0.55,ALDI
992,TOILET METAL SIGN,0.55,ASDA
993,SILVER PHOTO FRAME,2.1,ASDA
994,RED VICTORIAN FABRIC OVAL BOX,0.42,ALDI
995,GOLD PHOTO FRAME,2.1,ASDA
996,FAIRY CAKES ROUND NESTING BOXES,5.95,ASDA
997,METAL 4 HOOK HANGER FRENCH CHATEAU,2.95,Sainsbury's
998,ENCHANTED BIRD COATHANGER 5 HOOK,4.65,Tesco
999,SALLE DE BAIN HOOK,1.25,ALDI
1000,CREAM CUPID HEARTS COAT HANGER,3.25,ALDI
1001,CANDLE PLATE LACE WHITE,2.55,ALDI
1002,IVY HEART WREATH,6.75,Sainsbury's
1003,FAIRY CAKE FLANNEL ASSORTED COLOUR,2.55,ALDI
1004,SWISS ROLL TOWEL PINK SPOTS,2.95,Tesco
1005,SWISS ROLL TOWEL CHOCOLATE SPOTS,2.95,Tesco
1006,3 GARDENIA MORRIS BOXED CANDLES,4.25,ASDA
1007,SET/3 ROSE CANDLE IN JEWELLED BOX,4.25,Tesco
1008,ASSORTED TUTTI FRUTTI FOB NOTEBOOK,0.85,ALDI
1009,PARTY FOOD SHOPPER BAG,1.25,Sainsbury's
1010,STRAWBERRY CANDY BAG,1.25,LIDL
1011,RED SPOTTY CANDY BAG,1.25,Sainsbury's
1012,WALL MIRROR DIAMANTE OVAL SHAPE,9.95,Sainsbury's
1013,SPOTS DESIGN MUG W PINK INSIDE,1.65,Tesco
1014,JIGSAW TREE WITH BIRDHOUSE,1.45,ASDA
1015,MINI FUNKY DESIGN TAPES,0.85,Tesco
1016,SPACE FROG,1.25,LIDL
1017,SPACE CADET BLACK,1.25,Sainsbury's
1018,SWALLOW GIANT TUBE MATCHES,2.55,Tesco
1019,ABSTRACT CIRCLE JOURNAL ,2.55,ASDA
1020,EMPIRE BIRTHDAY CARD,0.42,LIDL
1021,MUMMY MOUSE RED GINGHAM RIBBON,5.45,Sainsbury's
1022,ABSTRACT CIRCLES NOTEBOOK,1.65,ALDI
1023,EDWARDIAN PARASOL RED,5.95,Sainsbury's
1024,RED DINER WALL CLOCK,8.5,ALDI
1025,EAU DE NIL DINER WALL CLOCK,8.5,ALDI
1026,BLUE DINER WALL CLOCK,8.5,Tesco
1027,BOMBS AWAY METAL SIGN,2.1,ALDI
1028,CHINESE DRAGON PAPER LANTERNS,0.42,Tesco
1029,BLUE PAPER PARASOL ,2.95,ASDA
1030,RED PAPER PARASOL,2.95,Sainsbury's
1031,RHOMBUS CRYSTAL PERFUME BOTTLE,1.95,LIDL
1032,GREEN CHERRY LIGHTS,6.75,ALDI
1033,BLACK CHERRY LIGHTS,6.75,Tesco
1034,GOLD CHERRY LIGHTS,6.75,Sainsbury's
1035,FLOOR LAMP SHADE WOOD BASE,8.49,Sainsbury's
1036,MIRROR MOSAIC VOTIVE HOLDER,1.85,Sainsbury's
1037,PINK FLOWER FABRIC PONY,3.75,LIDL
1038,CHRISTMAS HANGING HEART WITH BELL,1.25,Tesco
1039,WRAP PINK FAIRY CAKES ,0.42,LIDL
1040,CHRYSANTHEMUM SKETCHBOOK ,2.95,LIDL
1041,BLACK RECORD COVER FRAME,3.39,Sainsbury's
1042,GARLAND MAGIC GARDEN 1.8M,1.95,ALDI
1043,AFGHAN SLIPPER SOCK PAIR,3.45,Sainsbury's
1044,RED SPOTTY EGG CUP ,1.25,Sainsbury's
1045,SET/5 BLUE SPOTTY LID GLASS BOWLS,2.95,Tesco
1046,CREAM SLICE FLANNEL PINK SPOT ,2.95,Tesco
1047,TEATIME CAKE TIN WITH HANDLE,9.95,ASDA
1048,SET OF 4 FAIRY CAKES COASTERS ,1.25,LIDL
1049,FAIRY CAKE PLACEMATS,3.75,Tesco
1050,GLASS BEURRE DISH,3.95,Tesco
1051,CHRISTMAS TREE PAINTED ZINC ,0.65,Tesco
1052,CHRISTMAS HANGING STAR WITH BELL,1.25,ALDI
1053,S/3 TEAR DROP CUT GLASS DECORATION,1.25,LIDL
1054,MULTICOLOUR GLASS PLATE,0.55,Tesco
1055,WOODEN CHRISTMAS TREE 3 HANGING,0.42,LIDL
1056,PINK MARSHMALLOW SCARF KNITTING KIT,2.55,ASDA
1057,TOAST ITS - BEST MUM,1.05,Sainsbury's
1058,LADS ONLY TISSUE BOX,1.25,ASDA
1059,SET/3 POT PLANT CANDLES,4.95,LIDL
1060,SET 12 PEAR BOTANICAL T-LIGHTS,2.55,ASDA
1061,ROSE SCENT CANDLE IN JEWELLED BOX,3.81,Tesco
1062,SET OF 3 COLOURED FLYING DUCKS,4.65,ALDI
1063,SMALL FAIRY CAKE FRIDGE MAGNETS,1.45,LIDL
1064,KASBAH LANTERN WITH GLASS ,4.25,ASDA
1065,HANGING MEDINA LANTERN LARGE,3.75,LIDL
1066,SKULLS GREETING CARD,0.42,Sainsbury's
1067,CLASSIC METAL BIRDCAGE PLANT HOLDER,12.75,ASDA
1068,GOTHIC CARRIAGE LANTERN,5.95,ASDA
1069,ANTIQUE SILVER TEA GLASS ENGRAVED,1.25,ALDI
1070,CAKE STAND VICTORIAN FILIGREE LARGE,8.5,Tesco
1071,HANGING JAM JAR T-LIGHT HOLDER,0.85,LIDL
1072,BIG PINK POODLE,19.95,Sainsbury's
1073,SMALL MARAKESH LANTERN ON STICK,3.75,ASDA
1074,SNOWSTORM PHOTO FRAME FRIDGE MAGNET,0.85,Tesco
1075,LADLE LOVE HEART RED ,0.42,ALDI
1076,12 DAISY PEGS IN WOOD BOX,1.65,LIDL
1077,BIRD DECORATION GREEN SPOT,0.85,Tesco
1078,OCEAN STRIPE HAMMOCK ,7.95,ALDI
1079,ARCHED GREY MIRROR,12.75,Tesco
1080,VICTORIAN SEWING BOX SMALL ,5.95,ASDA
1081,GLASS CAKE STAND MIRRORED BASE,14.95,ASDA
1082,VINTAGE BEAD COSMETIC BAG ,3.35,LIDL
1083,VINTAGE BEAD PINK EVENING BAG,4.25,Sainsbury's
1084,VINTAGE BEAD PINK SCARF ,7.95,Sainsbury's
1085,VINTAGE BEAD PINK PURSE ,2.95,ALDI
1086,BLUE PULL BACK RACING CAR,0.55,Tesco
1087,FUNKY GIRLZ ASST MAGNETIC MEMO PAD,0.65,ASDA
1088,BLUE VICTORIAN FABRIC HEART BOX,0.42,Tesco
1089,ENGLISH ROSE NOTEBOOK A7 SIZE,0.42,Sainsbury's
1090,ASSORTED FLORAL SECATEURS,1.95,Tesco
1091,ASSORTED COLOUR SILK COSMETIC PURSE,2.1,ALDI
1092,JASMINE VOTIVE CANDLE,0.29,ALDI
1093,RED SPOTTY OVEN GLOVE ,1.25,Sainsbury's
1094,FRENCH BOTTLE LAVENDER,1.65,ALDI
1095,RETRO SPOT CANDLE LARGE,2.55,Sainsbury's
1096,RELAX LARGE WOOD LETTERS,15.95,Sainsbury's
1097,RETRO SPOT CERAMIC TOASTRACK,3.45,LIDL
1098,BLOSSOM IMAGES SCRAP BOOK SET,1.25,ALDI
1099,T-LIGHT HOLDER WHITE LACE,0.85,Sainsbury's
1100,WHITE LOVEBIRD LANTERN,2.95,ALDI
1101,SMALL RED SPOT WINDMILL,1.25,Tesco
1102,CREAM SWEETHEART TRAYS,9.95,Sainsbury's
1103,APPLE BATH SPONGE,1.25,LIDL
1104,GREEN SPOTTY BOWL,1.06,ASDA
1105,BAG 125g SWIRLY MARBLES,0.36,ALDI
1106,MULTICOLOUR 3D BALLS GARLAND,2.1,ASDA
1107,BOX OF 24 COCKTAIL PARASOLS,0.42,Tesco
1108,WRAP CHRISTMAS SCREEN PRINT,0.42,ALDI
1109,SCOTTS ROSES TILE COASTER,1.25,Tesco
1110,DISCO BALL ROTATOR BATTERY OPERATED,4.25,Sainsbury's
1111,DISCO BALL CHRISTMAS DECORATION,0.1,Tesco
1112,NOEL GARLAND PAINTED ZINC ,1.65,ASDA
1113,ETCHED GLASS STAR TREE DECORATION,1.25,LIDL
1114,BLUE/WHITE RIBBED MELAMINE JUG,7.95,Tesco
1115,POPCORN HOLDER LARGE,1.65,ASDA
1116,SKULL LUNCHBOX WITH CUTLERY ,2.55,Sainsbury's
1117,LARGE CIRCULAR MIRROR MOBILE,1.25,ASDA
1118,WHITE BELL HONEYCOMB PAPER ,1.65,Tesco
1119,EASTER CRAFT 4 CHICKS ,1.95,Tesco
1120,CHRISTMAS CRAFT LITTLE FRIENDS,2.1,ASDA
1121,SET/4 WHITE RETRO STORAGE CUBES ,34.95,ALDI
1122,BLACK EAR MUFF HEADPHONES,4.65,Tesco
1123,GARDEN PATH JOURNAL,2.55,ALDI
1124,FOLDING UMBRELLA CHOC/WHITE SPOT,4.95,ALDI
1125,OVERNIGHT BAG VINTAGE ROSE PAISLEY,4.95,LIDL
1126,FLOWERS WALL THERMOMETER,2.55,LIDL
1127,WAKE UP COCKEREL WALL THERMOMETER,2.55,LIDL
1128,COSY SLIPPER SHOES SMALL GREEN,2.95,Sainsbury's
1129,BALLOONS WRITING SET ,1.65,LIDL
1130,ASS FLORAL PRINT TORCH,1.65,Sainsbury's
1131,FRESHWATER PEARL BRACELET PINK,2.55,ALDI
1132,FRESHWATER PEARL BRACELET GOLD,2.55,ASDA
1133,75 GREEN FAIRY CAKE CASES,0.55,LIDL
1134,CHERRY BLOSSOM DECORATIVE FLASK,3.75,Tesco
1135,PATCHWORK PENCIL CASE BUTTERFLY ,2.1,Tesco
1136,POLKA DOT PISTACHIO PAIL,2.1,LIDL
1137,CUT GLASS T-LIGHT HOLDER OCTAGON,2.55,ALDI
1138,12 PENCILS SMALL TUBE POSY,0.65,Sainsbury's
1139,BABY BOOM RIBBONS ,1.25,ALDI
1140,JAZZ HEARTS MAGNETIC MEMO PAD,0.65,Tesco
1141,BLUE PAISLEY SKETCHBOOK,3.75,ALDI
1142,SET/6 EAU DE NIL BIRD T-LIGHTS,2.1,LIDL
1143,S/4 IVORY MINI ROSE CANDLE IN BOWL,1.65,ALDI
1144,SET/20 STRAWBERRY PAPER NAPKINS ,0.85,Sainsbury's
1145,PACK OF 12 WOODLAND TISSUES ,0.29,ASDA
1146,ASSORTED TUTTI FRUTTI LARGE PURSE,2.1,Tesco
1147,FLOWER FAIRY INCENSE LILY,1.69,Tesco
1148,FLOWER FAIRY INCENSE ROSE,1.69,LIDL
1149,ROSE DU SUD OVEN GLOVE,2.95,ALDI
1150,ASSORTED TUTTI FRUTTI ROUND BOX,1.65,ALDI
1151,SPACE OWL,1.25,ASDA
1152,BLUE FLOCK GLASS CANDLEHOLDER,0.38,ASDA
1153,PARTY PIZZA DISH PINK+WHITE SPOT ,0.85,ASDA
1154,PARTY PIZZA DISH GREEN+WHITE SPOT ,0.85,Sainsbury's
1155,PARTY PIZZA DISH BLUE+WHITE SPOT ,0.85,ASDA
1156,PARTY PIZZA DISH RED WHITE SPOT ,0.85,ASDA
1157,ASSORTED INCENSE PACK,0.21,LIDL
1158,DADDY MOUSE RED GINGHAM BOW TIE,5.45,Sainsbury's
1159,PACK OF 12 BLUE PAISLEY TISSUES ,0.29,Sainsbury's
1160,YELLOW DRAGONFLY HELICOPTER,7.95,ASDA
1161,BLUE DRAGONFLY HELICOPTER,7.95,LIDL
1162,RETRO PLASTIC ELEPHANT TRAY,0.85,ASDA
1163,S/3 ENGLISH LAVENDER SQU CANDLE,1.65,ALDI
1164,S/3 FRENCH VANILLA SQU CANDLE,1.65,Tesco
1165,ROSE 3 WICK MORRIS BOX CANDLE,4.25,Tesco
1166,GARDENIA 3 WICK MORRIS BOXED CANDLE,4.25,Sainsbury's
1167,GOLD FABRIC MIRROR,1.25,LIDL
1168,RETRO PLASTIC POLKA TRAY,0.42,LIDL
1169,"LETTER ""S"" BLING KEY RING",1.25,Sainsbury's
1170,"LETTER ""J"" BLING KEY RING",1.25,Sainsbury's
1171,DAISY ERASERS IN BAG,0.42,Tesco
1172,BLUE CALCULATOR RULER,1.25,ALDI
1173,HEART CALCULATOR,1.25,LIDL
1174,SET OF 4 PASTEL STACKING MUGS,2.55,ASDA
1175,SET/2 CHRISTMAS DECOUPAGE CANDLES,1.25,ASDA
1176,POCKET BAG BLUE PAISLEY RED SPOT,2.1,ASDA
1177,SET OF 6 FUNKY BEAKERS,2.95,LIDL
1178,VINTAGE PAISLEY STATIONERY SET,2.95,Sainsbury's
1179,BLUE TALL PORCELAIN T-LIGHT HOLDER,2.55,Sainsbury's
1180,ASSORTED COLOUR SILK COIN PURSE,1.25,ALDI
1181,GIANT BLACK SUNGLASSES,1.95,ALDI
1182,PINK PAISLEY SQUARE TISSUE BOX ,1.25,ALDI
1183,CANDY SPOT HAND BAG,2.1,LIDL
1184,SET/4 2 TONE EGG SHAPE MIXING BOWLS,9.95,Sainsbury's
1185,PINK VINTAGE PAISLEY PICNIC BAG,2.95,Tesco
1186,SCANDINAVIAN PAISLEY PICNIC BAG,2.95,ASDA
1187,FAIRY CAKES RECTANGLUAR BOXES,5.95,ASDA
1188,WOODLAND HEIGHT CHART STICKERS ,2.95,Sainsbury's
1189,SUKI SHOULDER BAG,1.65,LIDL
1190,DO NOT TOUCH MY STUFF DOOR HANGER ,1.45,ALDI
1191,VINTAGE GLASS SUGAR CADDY,5.95,LIDL
1192,SMALL ZINC/GLASS CANDLEHOLDER,1.49,ASDA
1193,PINK OWL SOFT TOY,2.95,ALDI
1194,BLUE OWL SOFT TOY,2.95,Tesco
1195,PURPLE ANEMONE ARTIFICIAL FLOWER,1.69,Sainsbury's
