2359,CRYSTAL STUD EARRINGS CLEAR DISPLAY,0.38,Tesco
2360,BASKET/8 SCENTED LOVE TOKEN CANDLES,3.75,ASDA
2361,CLEAR ACRYLIC FACETED BANGLE,2.95,Tesco
2362,FIRE POLISHED GLASS BRACELET BLACK,3.75,LIDL
2363,SILVER LARIAT BLACK STONE EARRINGS,4.25,Tesco
2364,MURANO STYLE GLASS BRACELET BLACK,3.5,LIDL
2365,SCULPTED ROUND IVORY CANDLE ,0.21,Sainsbury's
2366,BLACK FLOCK GOLD CANDLE,0.42,Tesco
2367,WHITE CERAMIC PARTY SET (5PCS),3.39,ASDA
2368,WRAP ROMANTIC DECOUPAGE,0.42,ALDI
2369,CLASSICAL ROSE CANDLESTAND,0.65,ALDI
2370,BLOND DOLL DOORSTOP,1.25,ALDI
2371,PEARL CRYSTAL PUMPKIN T-LIGHT HLDR,1.45,Tesco
2372,QUEEN OF THE SKIES HOLIDAY PURSE ,2.95,Sainsbury's
2373,STRAWBERRIES DESIGN FLANNEL ,0.85,ALDI
2374,CAKES AND RABBITS DESIGN FLANNEL ,0.85,LIDL
2375,FUSCHIA/GREEN STRIPE WOOLLY BLANKET,18.95,ASDA
2376,TEATIME PENCIL W STAMP ASST,0.42,Sainsbury's
2377,OCCASIONS GIFT CARD ASSORTMENT,0.55,ASDA
2378,DAIRY MAID STRIPE MUG,2.95,ALDI
2379,WHITE/PINK MINI CRYSTALS NECKLACE,4.95,ALDI
2380,PINK COMBO MINI CRYSTALS NECKLACE,4.95,ASDA
2381,FUNKY GIRL ADDRESS BOOK,1.25,LIDL
2382,DOTS IRONING BOARD COVER,1.95,ASDA
2383,TEA TIME KITCHEN APRON,5.95,ALDI
2384,SET OF 3 DANISH ROSE PLANTERS,4.25,Tesco
2385,COLUMBIAN CANDLE RECTANGLE,1.95,ASDA
2386,MIDNIGHT BLUE VINTAGE EARRINGS,3.75,Sainsbury's
2387,BIRDCAGE DECORATION MAGIC GARDEN,2.55,ASDA
2388,ROSE SCENT CANDLES IN GLASS,0.85,Tesco
2389,MODERN CHRISTMAS TREE CANDLE ,2.1,ALDI
2390,MODERN CHRISTMAS BAUBLE CANDLE ,0.42,Tesco
2391,MODERN CHRISTMAS TREE CANDLE,0.85,ALDI
2392,HOOK 5 HANGER MAGIC TOADSTOOL,1.65,Sainsbury's
2393,DROP DIAMANTE EARRINGS CRYSTAL,2.95,ASDA
2394,DROP DIAMANTE EARRINGS BLACK DIAMON,2.95,ALDI
2395,DROP DIAMANTE EARRINGS PURPLE,2.95,LIDL
2396,DROP DIAMANTE EARRINGS GREEN,2.95,Sainsbury's
2397,CLASSIC DIAMANTE EARRINGS JET,2.95,LIDL
2398,GLASS BEAD HOOP NECKLACE GREEN,8.5,ASDA
2399,RUBY GLASS CLUSTER NECKLACE,7.5,ALDI
2400,GREEN HEART COMPACT MIRROR,3.75,LIDL
2401,TREE OF NOAH FESTIVE SCENTED CANDLE,0.65,Tesco
2402,LAVENDER INCENSE 40 CONES IN TIN,1.25,Sainsbury's
2403,ASSORTED CHEESE FRIDGE MAGNETS,0.65,Tesco
2404,VINTAGE SHELLS PRINT,6.45,ALDI
2405,VINTAGE KITCHEN PRINT PUDDINGS,2.55,Tesco
2406,VINTAGE KITCHEN PRINT SEAFOOD,2.55,LIDL
2407,ZINC HEART LATTICE CHARGER SMALL,2.95,Sainsbury's
2408,RAIN GIRL CHILDS UMBRELLA,3.25,Sainsbury's
2409,S/16 VINTAGE ROSE CUTLERY,12.75,ASDA
2410,ENGLISH ROSE SET/3 GARDEN TOOLS,7.95,ASDA
2411,POTTING SHED SEED ENVELOPES,1.06,Tesco
2412,PINK DISCO HANDBAG,5.95,ASDA
2413,SILVER DISCO HANDBAG,5.95,Tesco
2414,METAL TUBE CHIME ON BAMBOO,1.69,LIDL
2415,PINK BOUDOIR T-LIGHT HOLDER,0.85,ASDA
2416,WHITE ANEMONE ARTIFICIAL FLOWER,1.69,ASDA
2417,NATURAL BARK CANDLE SMALL,2.75,ASDA
2418,BLACK FEATHER CHRISTMAS DECORATION,0.19,ALDI
2419,ANTIQUE OPAL WHITE FLOWER EARRINGS,4.25,ASDA
2420,MIDNIGHT BLUE COPPER FLOWER NECKLAC,5.95,Sainsbury's
2421,NEW BAROQUE B'FLY NECKLACE MONTANA,8.5,Sainsbury's
2422,CREAM SWEETHEART DOUBLE SHELF,16.95,ASDA
2423,WHITE TRAVEL ALARM CLOCK,2.55,Sainsbury's
2424,PINK FLUFFY CHRISTMAS DECORATION,0.19,ALDI
2425,SET/4 BUTTERFLY MIRROR MAGNETS,0.38,Sainsbury's
2426,PINK HEART RED HANDBAG,1.25,ASDA
2427,CLAM SHELL SMALL ,2.1,ALDI
2428,CERISE+GOLD CHRISTMAS TREE DEC,0.38,ASDA
2429,PINK FLY SWAT,0.65,ASDA
2430,ORANGE CANDLE,0.85,ALDI
2431,S/4 CONTEMPORY PINK ROSEBUD CANDLES,2.1,ALDI
2432,S/4 CONTEMPORY RED ROSEBUD CANDLES,2.1,ASDA
2433,BURG FLOCK GOLD CUP/CANDLE ,0.42,ASDA
2434,PINK JEWELLED PHOTO FRAME,7.95,Sainsbury's
2435,CROCHET LILAC/RED BEAR KEYRING,1.65,Tesco
2436,PAISLEY PATTERN STICKERS,0.85,ALDI
2437,POCKET MIRROR WOODLAND,1.25,ALDI
2438,POCKET MIRROR BUTTERFLY ,1.25,LIDL
2439,SWIRLY CIRCULAR RUBBERS IN BAG,0.19,LIDL
2440,GREEN/BLUE CERAMIC CANDLE HOLDER,1.65,ASDA
2441,SOFT PINK ROSE TOWEL ,4.65,LIDL
2442,PINK METAL CHICKEN HEART ,1.49,Tesco
2443,YELLOW POT PLANT CANDLE,3.75,Tesco
2444,BLUE DAISY MOBILE,3.75,ASDA
2445,S/4 ROSE PINK DINNER CANDLES,1.25,Sainsbury's
2446,PARTY TIME DESIGN FLANNEL,0.38,ASDA
2447,CANDY POP CHUNKY KNITTED THROW ,16.95,LIDL
2448,BUBBLE GUM CHUNKY KNITTED THROW ,16.95,Sainsbury's
2449,PINK/FLOWER RABBIT EGG WARMER ,2.1,Tesco
2450,PINK STRIPES SHOULDER BAG,2.95,ASDA
2451,BEACH HUT MIRROR,4.25,ALDI
2452,LARGE ZINC/GLASS CANDLEHOLDER,2.1,ASDA
2453,SWEETHEART CREAM STEEL TABLE RECT,19.95,Tesco
2454,OPAL WHITE/SILVER FLOWER NECKLACE,5.95,ALDI
2455,WHITE VINTAGE CRYSTAL BRACELET,6.75,LIDL
2456,BLACK VINT ART DEC CRYSTAL BRACELET,6.75,ASDA
2457,NEW BAROQUE B'FLY NECKLACE PINK,8.5,Sainsbury's
2458,BLUE MURANO TWIST NECKLACE,9.95,ASDA
2459,BLACK 3 BEAD DROP EARRINGS,2.95,ASDA
2460,GLASS BEAD HOOP NECKLACE MONTANA,8.5,Sainsbury's
2461,PURPLE AMETHYST NECKLACE W TASSEL,9.95,Sainsbury's
2462,JET BLACK LAS VEGAS NECKLACE 45CM,5.95,Tesco
2463,PURPLE LAS VEGAS BRACELET ROUND,3.75,ALDI
2464,GLASS SPHERE CANDLE STAND MEDIUM,5.45,Sainsbury's
2465,ELEPHANT CLIP W SUCTION CUP,0.42,LIDL
2466,SILVER HEART COMPACT MIRROR,3.75,ASDA
2467,S/6 SCANDINAVIAN HEART T-LIGHT,2.55,ALDI
2468,GOLD MUG BONE CHINA TREE OF LIFE,5.95,ASDA
2469,PURPLE ENAMEL FLOWER RING,2.95,Tesco
2470,LITTLE GREEN MONSTER SOFT TOY,2.55,Tesco
2471,VANILLA INCENSE 40 CONES IN TIN,1.25,ASDA
2472,OPIUM SCENTED VOTIVE CANDLE,0.29,ASDA
2473,SILVER MUG BONE CHINA TREE OF LIFE,5.95,Tesco
2474,COLUMBIAN CUBE CANDLE ,0.85,ALDI
2475,YELLOW/PINK FLOWER DESIGN BIG MUG,1.95,Tesco
2476,BLING KEY RING STAND,1.25,ASDA
2477,BLUE BIRDHOUSE DECORATION,0.85,Tesco
2478,SILVER OVAL SHAPE TRINKET BOX,9.95,Tesco
2479,PERIWINKLE T-LIGHT HOLDER,1.25,LIDL
2480,WHITE SILVER NECKLACE SHELL GLASS,9.95,LIDL
2481,PINK SWEETIE NECKLACE,7.5,ALDI
2482,FINE SILVER NECKLACE W PASTEL FLOWE,7.5,ASDA
2483,PINK HEART OF GLASS BRACELET,5.95,Tesco
2484,FIRE POLISHED GLASS NECKL GOLD,5.95,LIDL
2485,HOOK 5 HANGER MAGIC TOADSTOOL RED,1.65,LIDL
2486,"LETTER ""G"" BLING KEY RING",1.25,LIDL
2487,SET/4 BIRD MIRROR MAGNETS ,2.1,LIDL
2488,BLUE GREEN EMBROIDERY COSMETIC BAG,2.95,ALDI
2489,SET/4 SCENTED CANDLES IN RAMEKINS,3.75,Sainsbury's
2490,MULTICOLOUR EASTER RABBIT ,1.95,ALDI
2491,BOYS VINTAGE TIN SEASIDE BUCKET,2.55,ASDA
2492,GIRLS VINTAGE TIN SEASIDE BUCKET,2.55,LIDL
2493,FUNKY FLOWER COFFEE POT,3.75,Sainsbury's
2494,SUNSET COLOUR CHUNKY KNITTED THROW,16.95,ALDI
2495,CREAM AND PINK FLOWERS PONY ,3.75,LIDL
2496,GLASS JAR ENGLISH CONFECTIONERY,2.95,ASDA
2497,PINK HEARTS PAPER GARLAND,1.65,ALDI
2498,BUNNY DECORATION MAGIC GARDEN,0.85,LIDL
2499,DECORATION WHITE CHICK MAGIC GARDEN,0.85,LIDL
2500,DECORATION PINK CHICK MAGIC GARDEN,0.85,ASDA
2501,DECORATION BUTTERFLY MAGIC GARDEN,0.85,Tesco
2502,MINI ZINC GARDEN DECORATIONS ,0.85,ASDA
2503,MINI PAINTED GARDEN DECORATION ,0.85,LIDL
2504,ANGEL ON KNEES METAL POLE 100CM H,0.85,ASDA
2505,STANDING FAIRY POLE SUPPORT ,0.85,ALDI
2506,FAN BLACK FRAME ,0.29,Tesco
2507,BLACK BOX MIRROR LANTERN,5.95,Sainsbury's
2508,IVORY STRING CURTAIN WITH POLE ,5.95,Sainsbury's
2509,HEARTS PENCIL/RUBBER+5 MINI PENCILS,0.42,ALDI
2510,CLAM SHELL LARGE,3.75,LIDL
2511,EASTER DECORATION SITTING BUNNY,0.85,Sainsbury's
2512,BLACKCHRISTMAS TREE 30CM,1.25,Tesco
2513,PINK GLASS COCKTAIL LAMP,2.1,Sainsbury's
2514,GLASS CHALICE BLUE SMALL ,1.65,ALDI
2515,BLUE PORCELAIN B'FLY OIL BURNER,2.95,Sainsbury's
2516,ASS RETROSPOOF MUGSSPORTS,1.25,ASDA
2517,This is a test product.,4.5,Sainsbury's
2518,SCALLOP SHELL SOAP DISH,2.1,Tesco
2519,SMALL SILVER FLOWER CANDLE POT,2.95,ALDI
2520,ZINC POLICE BOX LANTERN,5.95,Tesco
2521,DOLLY HONEYCOMB GARLAND,1.65,Tesco
2522,SET/4 COLOURFUL MIXING BOWLS,9.95,Tesco
2523,FELT EGG COSY CHICKEN,0.85,Sainsbury's
2524,CITRONELLA CANDLE FLOWERPOT,2.1,Sainsbury's
2525,SET/2 TEA TOWELS MODERN VINTAGE,2.55,Sainsbury's
2526,S/3 POT POURI CUSHIONS BLUE COLOURS,2.1,ALDI
2527,CANDY SPOT EGG WARMER HARE,1.25,Tesco
2528,BLUE GINGHAM ROSE FLOOR CUSHION ,7.95,ALDI
2529,PURPLE PAPER PARASOL,2.95,Tesco
2530,GREETING CARD TWO SISTERS.,0.19,Tesco
2531,VINTAGE KEEPSAKE BOX PARIS DAYS,1.95,Tesco
2532,BLUE DIAMANTE PEN IN GIFT BOX,1.25,ASDA
2533,MIRRORED WALL ART TABLE LAMP,2.95,ASDA
2534,BLUE FELT EASTER EGG BASKET,1.65,ASDA
2535,PINK FELT EASTER EGG BASKET,1.65,Tesco
2536,PINK GLASS TASSLE BAG CHARM ,2.95,Tesco
2537,HAND OPEN SHAPE PINK,3.49,LIDL
2538,DANISH ROSE UMBRELLA STAND,15.95,ALDI
2539,ASSORTED CIRCULAR MOBILE,0.21,ALDI
2540,PINK PORCELAIN B'FLY OIL BURNER,2.95,Sainsbury's
2541,SILVER PURSE GOLD PINK BUTTERFLY,1.65,ASDA
2542,EDWARDIAN 2 DRAWER WALL CABINET ,35.95,ASDA
2543,F.FAIRY S/3 CANDLE/GLASSLAVENDER,1.95,ALDI
2544,REDWHITE STRIPE SCANDINAVIAN HEART ,0.38,LIDL
2545, LARGE SKULL WINDMILL,2.1,ASDA
2546,LARGE RED SPOT WINDMILL,2.1,Sainsbury's
2547,PORCELAIN BUDAH INCENSE HOLDER,0.1,ASDA
2548,CONGRATULATIONS BUNTING,5.45,ASDA
2549,SET 5 MINI GATEAUX FRIDGE MAGNETS,1.69,ASDA
2550,SET 5 MINI CHOCOLATE FRIDGE MAGNETS,1.69,Sainsbury's
2551,SILVER/AMETHYST DROP EARRINGS LEAF,2.95,ASDA
2552,AMETHYST HOOP EARRING FLORAL LEAF,2.95,Sainsbury's
2553,WHITE SATIN DRESS JEWEL STAND,4.95,ALDI
2554,DOOR MAT UNION FLAG,6.75,LIDL
2555,BLACK 3 TIER GLASS PLATE STAND,12.75,ASDA
2556,ASSORTED TUTTI FRUTTI KEYRING BALL,0.85,LIDL
2557,POLKADOT CUTLERY 24 PCS IN TRAY,9.95,LIDL
2558,DIAMANTE HAIR GRIP PACK/2 MONTANA,1.65,Sainsbury's
2559,DIAMANTE BOW BROOCH RED COLOUR,6.35,Sainsbury's
2560,JADE GREEN PAIR ENAMEL HAIR SLIDES,3.75,ASDA
2561,DIAMANTE HAIR GRIP PACK/2 RUBY,1.65,Tesco
2562,DIAMANTE HAIR GRIP PACK/2 PERIDOT,1.65,ALDI
2563,TROPICAL HOLIDAY PURSE ,2.95,ASDA
2564,BEADED CRYSTAL HEART GREEN SMALL,1.25,LIDL
2565,FRENCH CHATEAU OVAL PLATTER,7.95,LIDL
2566,JARDIN ETCHED GLASS FRUITBOWL,10.75,ALDI
2567,ZINC HEART LATTICE T-LIGHT HOLDER,1.25,ALDI
2568,LARGE TRIFLE DESIGN L BLUE BOWL,3.75,LIDL
2569,PINK TV TRAY TABLE ,4.25,ALDI
2570,BLUE TV TRAY TABLE ,4.25,LIDL
2571,CAROUSEL DESIGN WASHBAG,1.95,Sainsbury's
2572,WATERING CAN SINGLE HOOK PISTACHIO,1.69,LIDL
2573,CERISE+GOLD CHRISTMAS STOCKING DEC,0.38,ASDA
2574,FOLKART CHRISTMAS TREE T-LIGHT HOLD,0.38,Sainsbury's
2575,BLACK GRAND BAROQUE PHOTO FRAME,4.25,Sainsbury's
2576,GREEN WITH METAL BAG CHARM,4.95,ALDI
2577,DOOR MAT CAMOUFLAGE,4,ALDI
2578,ROUND PURPLE CLOCK W/SUCKER,0.85,LIDL
2579,PINK KNITTED KIDS RUCKSACK,6.75,Tesco
2580,YELLOW KNITTED KIDS RUCKSACK,6.75,LIDL
2581,SET OF 3 WICKER BASKET TEA AND CAKE,24.95,ASDA
2582,WHITE BIRD GARDEN DESIGN MUG,1.25,ASDA
2583,BLACK BIRD GARDEN DESIGN MUG,1.25,ASDA
2584,RED METAL BEACH SPADE ,1.25,ASDA
2585,PINK/PURPLE RETRO RADIO,2.95,Sainsbury's
2586,RECTANGULAR SHAPED MIRROR,1.69,Tesco
2587,S/6 PAPER BOXES BLOSSOM IMAGES ,4.25,ASDA
2588,S/6 PAPER BOXES ROMANTIC IMAGES,4.25,ALDI
2589,FOLKART ZINC CLIP ON ANGEL WINGS,0.38,Tesco
2590,SET/6 COLLAGE PAPER PLATES,0.85,LIDL
2591,FRUIT TREE AND BIRDS WALL PLAQUE,7.95,ASDA
2592,SMALL SQUARE CUT GLASS CANDLESTICK,4.95,LIDL
2593,RED GLASS TASSLE BAG CHARM,2.95,Sainsbury's
2594,AMBER GLASS TASSLE BAG CHARM,2.95,Sainsbury's
2595,PURPLE GLASS TASSLE BAG CHARM,2.95,Tesco
2596,ZINC HEART LATTICE DOUBLE PLANTER,3.75,ASDA
2597,ROSE DU SUD WASHBAG ,5.95,LIDL
2598,BATHROOM SET LOVE HEART DESIGN,2.95,Sainsbury's
2599,VINTAGE BEAD CHAISE LONG JEWEL BOX,6.75,Tesco
2600,ORIGAMI LAVENDER INCENSE+FLOWER,0.65,LIDL
2601,ORIGAMI OPIUM SCENT INCENSE+FLOWER,0.65,Sainsbury's
2602,ORIGAMI ROSE INCENSE+FLOWER,0.65,Tesco
2603,ORIGAMI SANDLEWOOD INCENSE+FLOWER,0.65,LIDL
2604,ORIGAMI OPIUM INCENSE/CANDLE SET ,0.85,ASDA
2605,ORIGAMI LAVENDER INCENSE IN TUBE,0.42,ASDA
2606,ORIGAMI ROSE INCENSE IN TUBE,0.42,Tesco
2607,SILVER ROCCOCO CHANDELIER,29.95,Sainsbury's
2608,POP ART PUSH DOWN RUBBER ,0.42,Sainsbury's
2609,PINK FLOWER HANGING HEART ,0.85,ALDI
2610,PINK RABBIT SITTING EASTER,0.42,ALDI
2611,HANGING BUTTERFLY EGG,0.85,LIDL
2612,FLORAL BATHROOM SET,3.75,ALDI
2613,MULTICOLOUR HONEYCOMB FAN,1.65,Sainsbury's
2614,WINE BOTTLE DRESSING LT.BLUE,0.29,LIDL
2615,PSYCHEDELIC TILE HOOK,2.1,LIDL
2616,PSYCHEDELIC TILE COASTER,1.25,LIDL
2617,GOLD/M.O.P PENDANT ORBIT NECKLACE,8.5,ALDI
2618,GOLD M.O.P ORBIT DROP EARRINGS,4.25,Sainsbury's
2619,PASTEL COLOUR HONEYCOMB FAN,1.65,ALDI
2620,PINK BUTTERFLY C/COVER ,4.95,ASDA
2621,PINK/YELLOW PATCH CUSHION COVER,7.65,Tesco
2622,SPACE CADET RED,1.25,Sainsbury's
2623,BEECH WOOD P/FRAME,7.25,ASDA
2624,TOYBOX WRAP ,0.42,Sainsbury's
2625,SUMMER FUN DESIGN SHOWER CAP,1.25,Sainsbury's
2626,KASHMIR FOLKART HEART DISHES,1.69,Sainsbury's
2627,SWEETHEART CREAM STEEL FOLDIN CHAIR,14.95,Tesco
2628,S/6 CHRISTMAS TREE PLACE SETTING,3.75,LIDL
2629,PINK HEART CHRISTMAS DECORATION,0.38,Sainsbury's
2630,FOLKART CLIP ON STARS,2.1,LIDL
2631,EASTER DECORATION HANGING BUNNY,0.65,LIDL
2632,ENGLISH ROSE TABLE CLOCK,1.95,Tesco
2633,CUTE RABBIT CEATURE SCREEN ,1.65,LIDL
2634,CUTE BIRD CEATURE SCREEN,1.65,LIDL
2635,GOLD FISHING GNOME,6.95,ALDI
2636,WOODLAND CREATURES WRAP,0.42,ASDA
2637,FAIRY CAKE WICKER PICNIC BASKET ,12.75,Tesco
2638,SILVER LOOKING MIRROR,4.95,ALDI
2639,BIRD IN TREE MUG ,1.25,LIDL
2640,CHRYSANTHEMUM POCKET BOOK ,0.85,Tesco
2641,ZINC HEART LATTICE 2 WALL PLANTER,6.35,Sainsbury's
2642,PASTEL PINK PHOTO ALBUM ,1.95,Tesco
2643,GOLD DIAMANTE STAR BROOCH,4.95,Tesco
2644,CAKE STAND LOVEBIRD 2 TIER PINK,9.95,Tesco
2645,PINK CHERRY BLOSSOM CUP & SAUCER,1.25,ASDA
2646,HAND OPEN SHAPE BLACK,3.49,Sainsbury's
2647,BLACK HEART CARD HOLDER,3.95,ALDI
2648,SET/6 POSIES PAPER PLATES,0.85,ALDI
2649,RETRO LAUNDRY TUB PISTACHIO,8.5,Sainsbury's
2650,BLACK SILOUETTE CANDLE PLATE ,2.1,LIDL
2651,CRYSTAL HOOP EARRING FLORAL LEAF,2.95,Sainsbury's
2652,FILIGREE DIAMANTE CHAIN,12.75,LIDL
2653,COPPER AND BRASS BAG CHARM,4.95,ALDI
2654,JARDIN ETCHED GLASS LARGE BELL JAR,10.95,ASDA
2655,FROG KING WATERING CAN,2.95,ASDA
2656,CHERRY BLOSSOM PURSE,2.95,Sainsbury's
2657,GREEN GEISHA GIRL ,3.75,Sainsbury's
2658,BEADED CRYSTAL HEART PINK\ON STICK,1.25,Sainsbury's
2659,FUSCHIA FLOWER PURSE WITH BEADS,1.49,Tesco
2660,BLUE FLOWER DES PURSE,1.25,ALDI
2661,ASS COLOUR GLOWING TIARAS,0.85,Sainsbury's
2662,EGG CUP NATURAL CHICKEN,1.25,Sainsbury's
2663,CONCH SHELL,3.75,ALDI
2664,SQUARE METAL CANDLEHOLDER BASE,0.85,Tesco
2665,BEADED PEARL HEART WHITE LARGE,1.65,ASDA
2666,5 STRAND GLASS NECKLACE AMBER,6.35,LIDL
2667,PINK POT PLANT CANDLE,3.75,Sainsbury's
2668,BIRDHOUSE DECORATION MAGIC GARDEN,1.25,LIDL
2669,WHITE HYDRANGEA ART FLOWER,2.1,LIDL
2670,PINK ROUND COMPACT MIRROR,3.75,ALDI
2671,LARGE TAHITI BEACH BAG,5.95,LIDL
2672,SMALL POP BOXFUNKY MONKEY,1.25,LIDL
2673,MULTICOLOUR CRUSOE CHECK LAMPSHADE,0.42,ASDA
2674,BEWARE OF THE CAT DOORMAT,6.75,Sainsbury's
2675,BLUE KNITTED HEN ,1.27,Tesco
2676,CREAM KNITTED HEN,1.27,Sainsbury's
2677,PEACH KNITTED HEN ,1.27,ALDI
2678,FOLK FELT HANGING MULTICOL GARLAND,2.95,Tesco
2679,HANGING HEART BASKET,1.69,LIDL
2680,WHITE BAMBOO RIBS LAMPSHADE,0.85,Sainsbury's
2681,PHOTO CLIP LINE,1.25,ALDI
2682,ANT WHITE HIGH RISE BIRD BOX,8.5,LIDL
2683,BLACK SQUARE TABLE CLOCK,2.55,LIDL
2684,WHITE HEART CONFETTI IN TUBE,1.65,LIDL
2685,PURPLE/COPPER HANGING LAMPSHADE,0.85,ASDA
2686,RED RETRO BAR STOOL,39.95,Sainsbury's
2687,DOOR MAT KISS MY.......,6.75,ASDA
2688,S/2 BEACH HUT TREASURE CHESTS,5.95,ASDA
2689,GREEN ROSE CUSHION COVER,5.95,LIDL
2690,EMPIRE TEDDY,6.95,LIDL
2691,RED TOP SCANDINAVIAN HEART ,0.38,Sainsbury's
2692,S/16 BLACK SHINY/MAT BAUBLES,0.42,Sainsbury's
2693,SMOKEY GREY COLOUR D.O.F. GLASS,0.65,ASDA
2694,WHITE CHRISTMAS TREE 60CM,2.95,Tesco
2695,BLACK FLOWER CANDLE PLATE,0.85,LIDL
2696,PINK RIVIERA HANDBAG,5.95,LIDL
2697,GOLD CHRISTMAS STOCKING DECORATION,1.95,ASDA
2698,MIRRORED WALL ART SKULLS,3.75,Sainsbury's
2699,PINK/BLUE DISC/MIRROR STRING,0.85,ALDI
2700,BLUE & WHITE BREAKFAST TRAY,5.95,Tesco
2701,SET/4 MODERN VINTAGE COTTON NAPKINS,2.95,LIDL
2702,SILVER BRACELET W PASTEL FLOWER,7.5,Sainsbury's
2703,"FLOWER GLASS GARLD NECKL36""AMETHYST",7.95,ALDI
2704,PINK GLASS CHUNKY CHARM BRACELET,8.95,ALDI
2705,COLUMBIAN CUBE CANDLE,1.65,Sainsbury's
2706,PINK SCOTTIE DOG W FLOWER PATTERN,2.55,ASDA
2707,PLANTPOT SINGLE HOOK PISTACHIO,1.69,ALDI
2708,FLOWER FAIRY OIL BURNER SET ROSE,1.25,Sainsbury's
2709,PACK/12 DECOUPAGE CARD,2.95,ASDA
2710,BOTANICAL LILY GIFT WRAP,0.42,ALDI
2711,BOTANICAL LAVENDER GIFT WRAP ,0.42,Tesco
2712,BLUE FLY SWAT,0.65,LIDL
2713,BOX OF 3 PEBBLE CANDLES,2.95,ALDI
2714,WHITE ROSEBUD PEARL EARRINGS,2.55,LIDL
2715,SILVER/MOP ORBIT NECKLACE,9.95,ASDA
2716,GOLD M PEARL ORBIT NECKLACE,9.95,LIDL
2717,CRACKED GLAZE NECKLACE BROWN,6.95,LIDL
2718,MIRRORED WALL ART SPLODGES,3.75,ALDI
2719,BLUE PAISLEY TISSUE BOX,1.25,Sainsbury's
2720,YELLOW BIRDS FELT DES FOODCOVER,3.75,ASDA
2721,WOVEN BUBBLE GUM CUSHION COVER,1.25,LIDL
2722,WOVEN CANDY CUSHION COVER ,1.25,Tesco
2723,WOVEN FROST CUSHION COVER,1.25,ASDA
2724,MAGAZINE RACK GEBRA ASSORTED ,1.25,LIDL
2725,MIXED NUTS LIGHT GREEN BOWL,1.25,ALDI
2726,OYSTER TRINKET BOX,3.25,ALDI
2727,GREEN BIRDHOUSE DECORATION,0.85,ALDI
2728,BLUE COL METAL FOLDING CHAIR,7.95,ASDA
2729,HANGING WOOD AND FELT BUTTERFLY ,0.42,Sainsbury's
2730,FELT EGG COSY WHITE RABBIT ,0.85,LIDL
2731,RED HEART CANDY POP LIGHTS,4.95,ALDI
2732,SKY BLUE COLOUR GLASS GEMS IN BAG,0.85,Sainsbury's
2733,DOORMAT RESPECTABLE HOUSE,6.75,ALDI
2734,DOORMAT AIRMAIL ,6.75,Tesco
2735,HEART MEASURING SPOONS SMALL,0.85,LIDL
2736,VINTAGE BEAD FILLED PINK CUSHION,4.95,ASDA
2737,BEADED CRYSTAL HEART BLUE LARGE,1.65,Tesco
2738,FLYING PIG WATERING CAN,2.95,Tesco
2739,BLUE BAROQUE FLOCK CANDLE HOLDER,5.95,ASDA
2740,VINTAGE METAL CAKE STAND CREAM ,12.75,LIDL
2741,BLUE DELPHINIUM ARTIFICIAL FLOWER,2.95,Sainsbury's
2742,PINK HYDRANGEA ART FLOWER,2.1,LIDL
2743,PINK FOXGLOVE ARTIIFCIAL FLOWER,2.55,Tesco
2744,WHITE FOXGLOVE ARTIIFCIAL FLOWER,2.55,ASDA
2745,DECORATION HANGING METAL RABBIT,1.25,ASDA
2746,HANGING SPRING FLOWER EGG SMALL,0.65,ASDA
2747,HOME SMALL WOOD LETTERS,4.95,Tesco
2748,SET/6 STRAWBERRY PAPER PLATES,0.85,ASDA
2749,ROMANTIC IMAGES NOTEBOOK SET,1.25,LIDL
2750,BLACK LOVE BIRD CANDLE,1.25,LIDL
2751, DOORMAT UNION JACK GUNS AND ROSES,6.75,Tesco
2752,NECKLACE+BRACELET SET BLUE BLOSSOM,2.55,Tesco
2753,NECKLACE+BRACELET PINK BUTTERFLY,2.55,ALDI
2754,BLUE KASHMIRI OCCASIONAL TABLE,79.95,ALDI
2755,ZINC HEART LATTICE PLANTER BOWL,2.95,Tesco
2756,ENGLISH ROSE SCENTED HANGING HEART,4.25,Tesco
2757,S/2 ZINC HEART DESIGN PLANTERS,9.95,Tesco
2758,KINGS CHOICE TEA CADDY ,2.95,Sainsbury's
2759,KINGS CHOICE BISCUIT TIN,4.25,LIDL
2760,PINK ALLIUM ARTIFICIAL FLOWER,1.69,Sainsbury's
2761,RED POPPY ARTIFICIAL FLOWER,1.69,LIDL
2762,PET MUG BUDGIE,0.42,LIDL
2763,PAINTED LIGHTBULB RAINBOW DESIGN,0.42,LIDL
2764,WHITE/PINK CHICK DECORATION,1.25,Sainsbury's
2765,WHITE/PINK CHICK EASTER DECORATION,0.85,LIDL
2766,FELT FARM ANIMAL WHITE BUNNY ,0.85,ALDI
2767,FLORAL PINK MONSTER,3.75,Tesco
2768,LITTLE FLOWER SHOPPER BAG,1.06,Tesco
2769,BLUE CLIMBING HYDRANGA ART FLOWER,2.95,Tesco
2770,PURPLE FOXGLOVE ARTIIFCIAL FLOWER,2.1,ASDA
2771,RED WALL CLOCK,7.65,Tesco
2772,IVORY WALL CLOCK,7.65,ASDA
2773,PINK OWL DECORATION,2.55,LIDL
2774,BLUE OWL DECORATION,2.55,LIDL
2775,BAG FOR CHILDREN VINTAGE PINK ,4.25,Tesco
2776,BAG FOR CHILDREN VINTAGE BLUE ,4.25,Tesco
2777,SMALL TAHITI BEACH BAG,4.65,ALDI
2778,PINK/YELLOW FLOWERS HANDBAG,1.95,LIDL
2779,PURPLE/TURQ FLOWERS HANDBAG,1.95,ASDA
2780,BLACK NEW BAROQUE FLOCK BOX,5.95,Tesco
2781,FRENCH PAISLEY CUSHION COVER ,2.95,LIDL
2782,BLACK BAROQUE WALL CLOCK ,12.75,ALDI
2783,SILVER DROP EARRINGS WITH FLOWER,3.75,Tesco
2784,ROUND SNACK BOXES SET4 WOODLAND ,2.95,ALDI
2785,ROUND SNACK BOXES SET 4 FRUITS ,2.95,Tesco
2786,HAWAIIAN GRASS SKIRT ,2.1,ASDA
2787,WHITE HAND TOWEL WITH BUTTERFLY,5.95,ALDI
2788,BATHROOM SCALES FOOTPRINTS IN SAND,2.95,ASDA
2789,PINK BABY GIRLS PHOTO ALBUM,5.95,ASDA
2790,BLUE TILE HOOK,2.55,LIDL
2791,CANDY SPOT BREAD BASKETS,4.95,ASDA
2792,PINK FAIRY CAKE COASTER,0.85,Tesco
2793,WHITE PICNIC BARBECUE BUCKET,10.75,LIDL
2794,CHERRY BLOSSOM PASSPORT COVER,2.1,LIDL
2795,SET/4 BLACK BAROQUE FLOCK COASTER,2.55,LIDL
2796,S/60 PINK FLUFFY CHICKS IN BOX,2.55,Sainsbury's
2797,GREETING CARD BLACKPOOL ROCK,0.19,ASDA
2798,GREEN PEONY DES C/COVER,4.65,LIDL
2799,RED PEONY DES C/COVER ,4.65,Sainsbury's
2800,BLUE SPOTTY PUDDING BOWL,2.1,LIDL
2801,DECORATION HANGING METAL CHICKEN,1.25,ALDI
2802,ROUND CONTAINER SET OF 5 RETROSPOT,1.65,ALDI
2803,CHILDS APRON SPACEBOY DESIGN,1.95,ASDA
2804,DOORMAT NEIGHBOURHOOD WITCH ,6.75,ASDA
2805,ROUND SNACK BOXES SET OF 4 SKULLS,2.95,ALDI
2806,ROUND SNACK BOXES SET OF 4 FRUITS ,2.95,ALDI
2807,WRAP CAROUSEL,0.42,ALDI
2808,ROUND SNACK BOXES SET OF4 WOODLAND ,2.95,ASDA
2809,EASTER BUNNY WREATH,4.95,Tesco
2810,BIRDCAGE DECORATION TEALIGHT HOLDER,1.25,ALDI
2811,BLUE PARTY BAGS ,2.1,ASDA
2812,WHITE SOAP RACK WITH 2 BOTTLES,5.95,Tesco
2813,GARLAND WOODEN HAPPY EASTER,1.25,LIDL
2814,GREEN METAL SWINGING BUNNY,0.85,ASDA
2815,PINK METAL SWINGING BUNNY,0.85,Tesco
2816,BROWN ANTIQUE CUBE CANDLE,0.42,Tesco
2817,SET OF 3 WICKER BASKET ROSE,24.95,LIDL
2818,CHERRY BLOSSOM TABLE CLOCK ,1.95,ALDI
2819,MIRRORED WALL ART LADIES,2.55,LIDL
2820,MIRRORED WALL ART GENTS,2.55,Sainsbury's
2821,BLUE CHENILLE SHAGGY CUSHION COVER ,1.95,LIDL
2822,BLACK SILVER FLOWER T-LIGHT HOLDER,0.85,ALDI
2823,PSYCHEDELIC WALL THERMOMETER,1.7,Sainsbury's
2824,S/4 BLACK LOVEBIRD COASTERS,2.55,ASDA
2825,SQUARE FLOOR CUSHION VINTAGE RED,7.95,ASDA
2826,PACK OF 12 STICKY BUNNIES,0.65,LIDL
2827,S/6 PINK EASTER DECS IN BOX,0.85,ASDA
2828,PINK FELT EASTER RABBIT GARLAND,2.55,ASDA
2829,ROUND FOOD CONTAINER S/5 RETROSPOT,1.65,ALDI
2830,PINK LOVE BIRD CANDLE,1.25,ALDI
2831,GREEN CRYSTAL DROP EARRINGS,2.95,LIDL
2832,PURPLE VINTAGE EARRINGS,3.75,Sainsbury's
2833,WHITE ROSEBUD PEARL BRACELET,7.5,Tesco
2834,CRYSTAL STUD EARRINGS ASSORTED COL ,1.06,ASDA
2835,PINK ROSEBUD PEARL EARRINGS,2.55,Tesco
2836,ROUND BLUE CLOCK W/SUCKER,0.85,Tesco
2837,ASS COL CIRCLE MOBILE ,0.42,Sainsbury's
2838,HEART DECORATION RUSTIC HANGING ,0.65,Tesco
2839,PINK STRING CURTAIN WITH POLE,5.95,LIDL
2840,YELLOW RABBIT SAT EASTER,0.42,Sainsbury's
2841,HELLO SAILOR BATHROOM SET,3.75,Sainsbury's
2842,CANDY STRIPE ROSE FLOOR CUSHION,7.95,LIDL
2843,BLUE KNITTED EGG COSY,1.95,Sainsbury's
2844,PAIR PADDED HANGERS PINK CHECK,3.75,ALDI
2845,PINK/GREEN FLOWER DESIGN BIG MUG,1.95,ALDI
2846,ASSORTED DESIGN FLOWER MUGS,0.85,ASDA
2847,SILVER ROCOCO CANDLE STICK,5.95,LIDL
2848,COGNAC AUX OEUFS METAL 1 HOOK,1.25,ASDA
2849,SET OF 3 RABBIT CARROTS EASTER,0.85,Tesco
2850,S/5 MINI ICE CREAM FRIDGE MAGNETS,1.45,ASDA
2851,CANDY SPOT HEART DECORATION,0.85,ALDI
2852,BLUE TILED SET OF 3 DRAWERS,12.75,Sainsbury's
2853,HOT BATHS SOAP HOLDER,1.69,ASDA
2854,SPACEBOY GIFT WRAP,0.42,ASDA
2855,SPACEBOY BIRTHDAY CARD,0.42,ASDA
2856,GLASS ETCHED T-LIGHT HOLDER LARGE,2.1,Sainsbury's
2857,HANGING WOOD AND FELT HEART,0.42,LIDL
2858,GREEN PICNIC BARBECUE BUCKET,10.75,ALDI
2859,FLAG OF ST GEORGE CAR FLAG,0.42,Tesco
2860,FLAG OF ST GEORGE ,1.65,Tesco
2861,GREETING CARD OVERCROWDED POOL.,0.19,ALDI
2862,MIRROR MOSAIC HURRICANE LAMP ,6.75,ALDI
2863,RUSSIAN FOLKART STACKING TINS,4.95,Tesco
2864,SMALL GLASS SUNDAE DISH CLEAR,1.65,LIDL
2865,SET/6 GREEN SPRING PAPER CUPS,0.65,LIDL
2866,SET/6 GREEN SPRING PAPER PLATE,0.85,Tesco
2867,BLUE BLOSSOM HAIR CLIP,1.05,Tesco
2868,LAVENDER SCENT CAKE CANDLE,0.29,Sainsbury's
2869,VANILLA SCENT CAKE CANDLE ,0.29,Tesco
2870,ORIGAMI ROSE INCENSE CONES,0.42,ALDI
2871,ORIGAMI VANILLA INCENSE CONES,0.42,LIDL
2872,FOLDING CAMPING SCISSOR W/KNIF & S,0.12,LIDL
2873,PAINTED PINK RABBIT ,0.85,Tesco
2874,PURPLE FRANGIPANI NECKLACE,2.55,Sainsbury's
2875,BLUE RETRO BAR STOOL,39.95,ASDA
2876,ORIGAMI VANILLA INCENSE+FLOWER ,2.1,Sainsbury's
2877,LITTLE PINK MONSTER SOFT TOY,2.55,LIDL
2878,S/3 ROSE GARDEN SCENT SQU CANDLE,1.65,ASDA
2879,IVORY HANGING DECORATION EGG,0.85,ASDA
2880,FRENCH CHATEAU LARGE PLATTER ,7.95,LIDL
2881,ORGANISER WOOD ANTIQUE WHITE ,8.5,ALDI
2882,S/3 PINK SQUARE PLANTERS ROSES,10.95,ALDI
2883,GREEN ROSE QUILT ,45.95,Sainsbury's
2884,S/3 RABBIT FLOWER/EGG/CARROT ROPE,0.85,ASDA
2885,SPOTTY COCKEREL DOORSTOP,4.25,LIDL
2886,PINK LARGE JEWELED PHOTOFRAME,2.55,ALDI
2887,"FLOWER GLASS GARLAND NECKL.36""GREEN",7.95,Tesco
2888,FLOWER GARLAND NECKLACE RED,7.95,ASDA
2889,STEEL SWEETHEART ROUND TABLE CREAM,14.95,Tesco
2890,PACK/12 BLUE FOLKART CARDS,2.95,ALDI
2891,SILVER SKULL HOT WATER BOTTLE ,3.75,ASDA
2892,BLUE KASHMIRI BOXED MIRROR,20,Tesco
2893,PINK KASHMIRI BOXED MIRROR,20,ASDA
2894,SPOTS MUG,1.65,ALDI
2895,ASSORTED SHAPES PHOTO CLIP SILVER ,0.65,LIDL
2896,LARGE WHITE/PINK ROSE ART FLOWER,2.12,ASDA
2897,CREAM DELPHINIUM ARTIFICIAL FLOWER,2.95,ASDA
2898,ROSE DU SUD DRAWSTRING BAG,4.25,ALDI
2899,CANDY SPOT TEA COSY,3.35,ASDA
2900,PADS TO MATCH ALL CUSHIONS,0.001,Tesco
2901,CLEAR MILKSHAKE GLASS,2.1,ALDI
2902,WRAP BAD HAIR DAY,0.1,Sainsbury's
2903,CLASSIC FRENCH STYLE BASKET BROWN,6.75,Sainsbury's
2904,CLASSIC FRENCH STYLE BASKET GREEN ,6.75,ALDI
2905,SET/6 FRUIT SALAD PAPER CUPS,0.65,Tesco
2906,LARGE GLASS SUNDAE DISH CLEAR,2.55,ALDI
2907,FROSTED GLASS WITH SILVER SURROUND,1.65,Sainsbury's
2908,RAINBOW PEGS PHOTO CLIP STRING,0.65,ALDI
2909,FELT FARM ANIMAL SHEEP,1.25,ASDA
2910,FEATHER HEART LIGHTS,2.95,ASDA
2911,FLOWERS AND BIRDS WALL PLAQUE,7.95,Sainsbury's
2912,PINK SQUARE TABLE CLOCK,2.55,ASDA
2913,METAL WALL SHELF UNIT WITH HOOKS,49.95,LIDL
2914,IVORY SHELL HEART NECKLACE,6.25,LIDL
2915,ORIGAMI SANDLEWOOD INCENSE CONES,1.65,ALDI
2916,SPRIG LAVENDER ARTIFICIAL FLOWER,1.25,ALDI
2917,S/12 MINI RABBIT EASTER,1.65,ASDA
2918,SMALL GLASS ROSE SCENTED CANDLE,3.75,Tesco
2919,LARGE GLASS ROSE SCENTED CANDLE ,7.95,Sainsbury's
2920,ORANGE FLOWER MUG ,1.25,Tesco
2921,SWEETHEART CREAM STEEL FOLDIN BENCH,19.95,ALDI
2922,BEADED CRYSTAL HEART GREEN LARGE,1.65,ALDI
2923,POP-ART FLUORESCENT PENS,0.06,Sainsbury's
2924,TRANSPARENT ACRYLIC TAPE DISPENSER,0.25,ASDA
2925,EASTER BUNNY HANGING GARLAND,1.25,Tesco
2926,BLACK RETRO BAR STOOL,35.95,Sainsbury's
2927,FUSCHIA RETRO BAR STOOL,35.95,Tesco
2928,BLOSSOM IMAGES GIFT WRAP SET,2.1,LIDL
2929,NAMASTE SWAGAT INCENSE,0.3,Tesco
2930,TOY TIDY SPACEBOY ,2.1,ASDA
2931,LUNCHBAG SUKI DESIGN ,1.65,Sainsbury's
2932,LUNCHBAG SPACEBOY DESIGN ,1.65,Sainsbury's
2933,PINK/PURPLE CIRCLE CURTAIN,4.65,Tesco
2934,BLUE WHITE SPOTS GARDEN PARASOL,7.95,Sainsbury's
2935,ICE CREAM DESIGN GARDEN PARASOL,7.95,ALDI
2936,PINK WHITE SPOTS GARDEN PARASOL,7.95,LIDL
2937,PINK LEAVES AND BEADS PHONE CHARM,1.25,ALDI
